Date,Time,CO(GT),PT08.S1(CO),NMHC(GT),C6H6(GT),PT08.S2(NMHC),NOx(GT),PT08.S3(NOx),NO2(GT),PT08.S4(NO2),PT08.S5(O3),T,RH,AH,DateTime
10/03/2004,18:00:00,-200.0,1360.0,150.0,,1046.0,166.0,1056.0,113.0,1692.0,1268.0,-200.0,-200.0,-200.0,2004-03-10 18:00:00
10/03/2004,19:00:00,2.0,1292.0,112.0,,955.0,103.0,1174.0,92.0,1559.0,972.0,-200.0,-200.0,-200.0,2004-03-10 19:00:00
10/03/2004,20:00:00,-200.0,1402.0,88.0,,939.0,131.0,1140.0,114.0,1555.0,1074.0,-200.0,-200.0,-200.0,2004-03-10 20:00:00
10/03/2004,21:00:00,-200.0,1376.0,80.0,,948.0,172.0,1092.0,122.0,1584.0,1203.0,-200.0,-200.0,-200.0,2004-03-10 21:00:00
10/03/2004,22:00:00,-200.0,1272.0,51.0,,836.0,131.0,1205.0,116.0,1490.0,1110.0,-200.0,-200.0,-200.0,2004-03-10 22:00:00
10/03/2004,23:00:00,-200.0,1197.0,38.0,,750.0,89.0,1337.0,96.0,1393.0,949.0,-200.0,-200.0,-200.0,2004-03-10 23:00:00
11/03/2004,00:00:00,-200.0,1185.0,31.0,,690.0,62.0,1462.0,77.0,1333.0,733.0,-200.0,-200.0,-200.0,2004-03-11 00:00:00
11/03/2004,01:00:00,1.0,1136.0,31.0,,672.0,62.0,1453.0,76.0,1333.0,730.0,-200.0,-200.0,-200.0,2004-03-11 01:00:00
11/03/2004,02:00:00,-200.0,1094.0,24.0,,609.0,45.0,1579.0,60.0,1276.0,620.0,-200.0,-200.0,-200.0,2004-03-11 02:00:00
11/03/2004,03:00:00,-200.0,1010.0,19.0,,561.0,180.0,1705.0,109.0,1235.0,501.0,-200.0,-200.0,-200.0,2004-03-11 03:00:00
11/03/2004,04:00:00,-200.0,1011.0,14.0,,527.0,21.0,1818.0,34.0,1197.0,445.0,-200.0,-200.0,-200.0,2004-03-11 04:00:00
11/03/2004,05:00:00,-200.0,1066.0,8.0,,512.0,16.0,1918.0,28.0,1182.0,422.0,-200.0,-200.0,-200.0,2004-03-11 05:00:00
11/03/2004,06:00:00,-200.0,1052.0,16.0,,553.0,34.0,1738.0,48.0,1221.0,472.0,-200.0,-200.0,-200.0,2004-03-11 06:00:00
11/03/2004,07:00:00,-200.0,1144.0,29.0,,667.0,98.0,1490.0,82.0,1339.0,730.0,-200.0,-200.0,-200.0,2004-03-11 07:00:00
11/03/2004,08:00:00,2.0,1333.0,64.0,,900.0,174.0,1136.0,112.0,1517.0,1102.0,-200.0,-200.0,-200.0,2004-03-11 08:00:00
11/03/2004,09:00:00,-200.0,1351.0,87.0,,960.0,129.0,1079.0,101.0,1583.0,1028.0,-200.0,-200.0,-200.0,2004-03-11 09:00:00
11/03/2004,10:00:00,-200.0,1233.0,77.0,,827.0,112.0,1218.0,98.0,1446.0,860.0,-200.0,-200.0,-200.0,2004-03-11 10:00:00
11/03/2004,11:00:00,-200.0,1179.0,43.0,,762.0,95.0,1328.0,92.0,1362.0,671.0,-200.0,-200.0,-200.0,2004-03-11 11:00:00
11/03/2004,12:00:00,-200.0,1236.0,61.0,,774.0,104.0,1301.0,95.0,1401.0,664.0,-200.0,-200.0,-200.0,2004-03-11 12:00:00
11/03/2004,13:00:00,-200.0,1286.0,63.0,,869.0,146.0,1162.0,112.0,1537.0,799.0,-200.0,-200.0,-200.0,2004-03-11 13:00:00
11/03/2004,14:00:00,-200.0,1371.0,164.0,,1034.0,207.0,983.0,128.0,1730.0,1037.0,-200.0,-200.0,-200.0,2004-03-11 14:00:00
11/03/2004,15:00:00,-200.0,1310.0,79.0,,933.0,184.0,1082.0,126.0,1647.0,946.0,-200.0,-200.0,-200.0,2004-03-11 15:00:00
11/03/2004,16:00:00,-200.0,1292.0,95.0,,912.0,193.0,1103.0,131.0,1591.0,957.0,-200.0,-200.0,-200.0,2004-03-11 16:00:00
11/03/2004,17:00:00,-200.0,1383.0,150.0,,1020.0,243.0,1008.0,135.0,1719.0,1104.0,-200.0,-200.0,-200.0,2004-03-11 17:00:00
11/03/2004,18:00:00,-200.0,1581.0,307.0,,1319.0,281.0,799.0,151.0,2083.0,1409.0,-200.0,-200.0,-200.0,2004-03-11 18:00:00
11/03/2004,19:00:00,-200.0,1776.0,461.0,,1488.0,383.0,702.0,172.0,2333.0,1704.0,-200.0,-200.0,-200.0,2004-03-11 19:00:00
11/03/2004,20:00:00,-200.0,1640.0,401.0,,1404.0,351.0,743.0,165.0,2191.0,1654.0,-200.0,-200.0,-200.0,2004-03-11 20:00:00
11/03/2004,21:00:00,-200.0,1313.0,197.0,,1076.0,240.0,957.0,136.0,1707.0,1285.0,-200.0,-200.0,-200.0,2004-03-11 21:00:00
11/03/2004,22:00:00,-200.0,965.0,61.0,,749.0,94.0,1325.0,85.0,1333.0,821.0,-200.0,-200.0,-200.0,2004-03-11 22:00:00
11/03/2004,23:00:00,1.0,913.0,26.0,,629.0,47.0,1565.0,53.0,1252.0,552.0,-200.0,-200.0,-200.0,2004-03-11 23:00:00
12/03/2004,00:00:00,-200.0,1080.0,55.0,,805.0,122.0,1254.0,97.0,1375.0,816.0,-200.0,-200.0,-200.0,2004-03-12 00:00:00
12/03/2004,01:00:00,-200.0,1044.0,53.0,,829.0,133.0,1247.0,110.0,1378.0,832.0,-200.0,-200.0,-200.0,2004-03-12 01:00:00
12/03/2004,02:00:00,-200.0,988.0,40.0,,718.0,82.0,1396.0,91.0,1304.0,692.0,-200.0,-200.0,-200.0,2004-03-12 02:00:00
12/03/2004,03:00:00,-200.0,889.0,21.0,,574.0,180.0,1680.0,109.0,1187.0,512.0,-200.0,-200.0,-200.0,2004-03-12 03:00:00
12/03/2004,04:00:00,-200.0,831.0,10.0,,506.0,21.0,1893.0,32.0,1134.0,384.0,-200.0,-200.0,-200.0,2004-03-12 04:00:00
12/03/2004,05:00:00,-200.0,847.0,7.0,,501.0,30.0,1895.0,44.0,1155.0,394.0,-200.0,-200.0,-200.0,2004-03-12 05:00:00
12/03/2004,06:00:00,-200.0,927.0,17.0,,571.0,56.0,1685.0,71.0,1223.0,487.0,-200.0,-200.0,-200.0,2004-03-12 06:00:00
12/03/2004,07:00:00,-200.0,1091.0,33.0,,730.0,109.0,1387.0,104.0,1361.0,748.0,-200.0,-200.0,-200.0,2004-03-12 07:00:00
12/03/2004,08:00:00,-200.0,1587.0,202.0,,1236.0,307.0,897.0,141.0,1900.0,1400.0,-200.0,-200.0,-200.0,2004-03-12 08:00:00
12/03/2004,09:00:00,-200.0,1545.0,150.0,,1353.0,180.0,767.0,109.0,2058.0,1588.0,-200.0,-200.0,-200.0,2004-03-12 09:00:00
12/03/2004,10:00:00,-200.0,1350.0,208.0,,1118.0,187.0,912.0,122.0,1712.0,1237.0,-200.0,-200.0,-200.0,2004-03-12 10:00:00
12/03/2004,11:00:00,-200.0,1263.0,166.0,,1037.0,216.0,969.0,143.0,1598.0,1167.0,-200.0,-200.0,-200.0,2004-03-12 11:00:00
12/03/2004,12:00:00,-200.0,1206.0,114.0,,986.0,143.0,1035.0,113.0,1537.0,959.0,-200.0,-200.0,-200.0,2004-03-12 12:00:00
12/03/2004,13:00:00,-200.0,1252.0,140.0,,1016.0,160.0,1008.0,116.0,1593.0,983.0,-200.0,-200.0,-200.0,2004-03-12 13:00:00
12/03/2004,14:00:00,-200.0,1287.0,169.0,,1078.0,163.0,949.0,123.0,1660.0,1061.0,-200.0,-200.0,-200.0,2004-03-12 14:00:00
12/03/2004,15:00:00,-200.0,1353.0,185.0,,1122.0,190.0,922.0,126.0,1740.0,1139.0,-200.0,-200.0,-200.0,2004-03-12 15:00:00
12/03/2004,16:00:00,-200.0,1309.0,165.0,,1073.0,178.0,954.0,120.0,1657.0,1112.0,-200.0,-200.0,-200.0,2004-03-12 16:00:00
12/03/2004,17:00:00,-200.0,1274.0,133.0,,1041.0,150.0,1006.0,119.0,1610.0,994.0,-200.0,-200.0,-200.0,2004-03-12 17:00:00
12/03/2004,18:00:00,-200.0,1510.0,233.0,,1277.0,206.0,812.0,149.0,1910.0,1410.0,-200.0,-200.0,-200.0,2004-03-12 18:00:00
12/03/2004,19:00:00,-200.0,1525.0,242.0,,1246.0,202.0,821.0,145.0,1847.0,1448.0,-200.0,-200.0,-200.0,2004-03-12 19:00:00
12/03/2004,20:00:00,-200.0,1843.0,488.0,,1610.0,340.0,624.0,170.0,2390.0,1887.0,-200.0,-200.0,-200.0,2004-03-12 20:00:00
12/03/2004,21:00:00,-200.0,1598.0,333.0,,1299.0,274.0,752.0,149.0,1941.0,1627.0,-200.0,-200.0,-200.0,2004-03-12 21:00:00
12/03/2004,22:00:00,-200.0,1484.0,215.0,,1127.0,253.0,839.0,139.0,1723.0,1491.0,-200.0,-200.0,-200.0,2004-03-12 22:00:00
12/03/2004,23:00:00,-200.0,1677.0,367.0,,1346.0,300.0,741.0,134.0,2062.0,1657.0,-200.0,-200.0,-200.0,2004-03-12 23:00:00
13/03/2004,00:00:00,-200.0,1280.0,122.0,,964.0,193.0,963.0,113.0,1544.0,1285.0,-200.0,-200.0,-200.0,2004-03-13 00:00:00
13/03/2004,01:00:00,-200.0,1196.0,67.0,,873.0,139.0,1071.0,97.0,1463.0,1144.0,-200.0,-200.0,-200.0,2004-03-13 01:00:00
13/03/2004,02:00:00,-200.0,1184.0,43.0,,782.0,83.0,1176.0,82.0,1365.0,1043.0,-200.0,-200.0,-200.0,2004-03-13 02:00:00
13/03/2004,03:00:00,-200.0,1172.0,46.0,,783.0,180.0,1179.0,109.0,1380.0,996.0,-200.0,-200.0,-200.0,2004-03-13 03:00:00
13/03/2004,04:00:00,-200.0,1147.0,56.0,,821.0,109.0,1132.0,83.0,1412.0,992.0,-200.0,-200.0,-200.0,2004-03-13 04:00:00
13/03/2004,05:00:00,1.0,978.0,30.0,,625.0,62.0,1420.0,65.0,1274.0,819.0,-200.0,-200.0,-200.0,2004-03-13 05:00:00
13/03/2004,06:00:00,-200.0,1100.0,27.0,,646.0,53.0,1406.0,60.0,1268.0,835.0,-200.0,-200.0,-200.0,2004-03-13 06:00:00
13/03/2004,07:00:00,-200.0,1112.0,47.0,,770.0,139.0,1228.0,77.0,1409.0,940.0,-200.0,-200.0,-200.0,2004-03-13 07:00:00
13/03/2004,08:00:00,-200.0,1336.0,132.0,,1043.0,256.0,935.0,96.0,1678.0,1192.0,-200.0,-200.0,-200.0,2004-03-13 08:00:00
13/03/2004,09:00:00,-200.0,1408.0,239.0,,1153.0,295.0,830.0,119.0,1777.0,1411.0,-200.0,-200.0,-200.0,2004-03-13 09:00:00
13/03/2004,10:00:00,-200.0,1447.0,160.0,,1081.0,250.0,869.0,126.0,1667.0,1465.0,-200.0,-200.0,-200.0,2004-03-13 10:00:00
13/03/2004,11:00:00,-200.0,1542.0,283.0,,1184.0,296.0,808.0,158.0,1780.0,1583.0,-200.0,-200.0,-200.0,2004-03-13 11:00:00
13/03/2004,12:00:00,-200.0,1451.0,210.0,,1117.0,239.0,875.0,161.0,1679.0,1387.0,-200.0,-200.0,-200.0,2004-03-13 12:00:00
13/03/2004,13:00:00,-200.0,1328.0,154.0,,1059.0,153.0,987.0,124.0,1600.0,1101.0,-200.0,-200.0,-200.0,2004-03-13 13:00:00
13/03/2004,14:00:00,2.0,1207.0,112.0,,924.0,118.0,1088.0,102.0,1488.0,850.0,-200.0,-200.0,-200.0,2004-03-13 14:00:00
13/03/2004,15:00:00,2.0,1240.0,108.0,,947.0,119.0,1049.0,116.0,1532.0,947.0,-200.0,-200.0,-200.0,2004-03-13 15:00:00
13/03/2004,16:00:00,-200.0,1306.0,111.0,,987.0,138.0,1004.0,124.0,1554.0,1078.0,-200.0,-200.0,-200.0,2004-03-13 16:00:00
13/03/2004,17:00:00,-200.0,1326.0,97.0,,1000.0,148.0,976.0,125.0,1602.0,1084.0,-200.0,-200.0,-200.0,2004-03-13 17:00:00
13/03/2004,18:00:00,-200.0,1473.0,191.0,,1163.0,227.0,831.0,148.0,1779.0,1395.0,-200.0,-200.0,-200.0,2004-03-13 18:00:00
13/03/2004,19:00:00,-200.0,1609.0,258.0,,1286.0,277.0,758.0,165.0,1922.0,1612.0,-200.0,-200.0,-200.0,2004-03-13 19:00:00
13/03/2004,20:00:00,-200.0,1611.0,284.0,,1274.0,279.0,754.0,161.0,1915.0,1697.0,-200.0,-200.0,-200.0,2004-03-13 20:00:00
13/03/2004,21:00:00,-200.0,1621.0,269.0,,1247.0,283.0,762.0,159.0,1860.0,1886.0,-200.0,-200.0,-200.0,2004-03-13 21:00:00
13/03/2004,22:00:00,-200.0,1444.0,180.0,,1089.0,214.0,844.0,143.0,1748.0,1624.0,-200.0,-200.0,-200.0,2004-03-13 22:00:00
13/03/2004,23:00:00,-200.0,1418.0,116.0,,1010.0,172.0,892.0,130.0,1603.0,1536.0,-200.0,-200.0,-200.0,2004-03-13 23:00:00
14/03/2004,00:00:00,-200.0,1534.0,93.0,,1013.0,190.0,889.0,129.0,1611.0,1535.0,-200.0,-200.0,-200.0,2004-03-14 00:00:00
14/03/2004,01:00:00,-200.0,1484.0,131.0,,1045.0,174.0,880.0,119.0,1624.0,1530.0,-200.0,-200.0,-200.0,2004-03-14 01:00:00
14/03/2004,02:00:00,-200.0,1367.0,92.0,,925.0,128.0,953.0,104.0,1543.0,1337.0,-200.0,-200.0,-200.0,2004-03-14 02:00:00
14/03/2004,03:00:00,-200.0,1344.0,132.0,,968.0,180.0,921.0,109.0,1620.0,1278.0,-200.0,-200.0,-200.0,2004-03-14 03:00:00
14/03/2004,04:00:00,-200.0,1130.0,56.0,,773.0,70.0,1130.0,82.0,1452.0,1051.0,-200.0,-200.0,-200.0,2004-03-14 04:00:00
14/03/2004,05:00:00,-200.0,1062.0,32.0,,691.0,53.0,1272.0,70.0,1377.0,929.0,-200.0,-200.0,-200.0,2004-03-14 05:00:00
14/03/2004,06:00:00,1.0,1076.0,29.0,,618.0,44.0,1395.0,63.0,1333.0,872.0,-200.0,-200.0,-200.0,2004-03-14 06:00:00
14/03/2004,07:00:00,-200.0,1028.0,27.0,,615.0,74.0,1384.0,67.0,1340.0,853.0,-200.0,-200.0,-200.0,2004-03-14 07:00:00
14/03/2004,08:00:00,-200.0,1155.0,36.0,,722.0,101.0,1225.0,84.0,1414.0,959.0,-200.0,-200.0,-200.0,2004-03-14 08:00:00
14/03/2004,09:00:00,-200.0,1235.0,57.0,,828.0,118.0,1055.0,83.0,1527.0,1093.0,-200.0,-200.0,-200.0,2004-03-14 09:00:00
14/03/2004,10:00:00,-200.0,1332.0,129.0,,923.0,144.0,952.0,98.0,1614.0,1225.0,-200.0,-200.0,-200.0,2004-03-14 10:00:00
14/03/2004,11:00:00,-200.0,1445.0,148.0,,1009.0,176.0,878.0,114.0,1696.0,1355.0,-200.0,-200.0,-200.0,2004-03-14 11:00:00
14/03/2004,12:00:00,-200.0,1416.0,145.0,,1002.0,161.0,907.0,119.0,1677.0,1262.0,-200.0,-200.0,-200.0,2004-03-14 12:00:00
14/03/2004,13:00:00,2.0,1281.0,93.0,,880.0,113.0,1084.0,104.0,1525.0,980.0,-200.0,-200.0,-200.0,2004-03-14 13:00:00
14/03/2004,14:00:00,-200.0,1207.0,84.0,,879.0,103.0,1104.0,102.0,1490.0,872.0,-200.0,-200.0,-200.0,2004-03-14 14:00:00
14/03/2004,15:00:00,-200.0,1258.0,99.0,,906.0,112.0,1081.0,107.0,1511.0,900.0,-200.0,-200.0,-200.0,2004-03-14 15:00:00
14/03/2004,16:00:00,3.0,1458.0,150.0,,1045.0,170.0,974.0,129.0,1646.0,1099.0,-200.0,-200.0,-200.0,2004-03-14 16:00:00
14/03/2004,17:00:00,-200.0,1438.0,156.0,,1051.0,180.0,943.0,128.0,1668.0,1206.0,-200.0,-200.0,-200.0,2004-03-14 17:00:00
14/03/2004,18:00:00,-200.0,1478.0,122.0,,1055.0,160.0,929.0,121.0,1671.0,1262.0,-200.0,-200.0,-200.0,2004-03-14 18:00:00
14/03/2004,19:00:00,-200.0,1808.0,262.0,,1312.0,261.0,753.0,157.0,1993.0,1698.0,-200.0,-200.0,-200.0,2004-03-14 19:00:00
14/03/2004,20:00:00,-200.0,1898.0,341.0,,1381.0,325.0,681.0,173.0,2103.0,1905.0,-200.0,-200.0,-200.0,2004-03-14 20:00:00
14/03/2004,21:00:00,-200.0,1560.0,214.0,,1140.0,217.0,784.0,146.0,1818.0,1648.0,-200.0,-200.0,-200.0,2004-03-14 21:00:00
14/03/2004,22:00:00,-200.0,1324.0,100.0,,940.0,146.0,924.0,121.0,1587.0,1423.0,-200.0,-200.0,-200.0,2004-03-14 22:00:00
14/03/2004,23:00:00,-200.0,1349.0,79.0,,933.0,152.0,933.0,119.0,1617.0,1349.0,-200.0,-200.0,-200.0,2004-03-14 23:00:00
15/03/2004,00:00:00,-200.0,1239.0,66.0,,872.0,104.0,985.0,99.0,1547.0,1250.0,-200.0,-200.0,-200.0,2004-03-15 00:00:00
15/03/2004,01:00:00,-200.0,1239.0,73.0,,853.0,106.0,1010.0,93.0,1543.0,1174.0,-200.0,-200.0,-200.0,2004-03-15 01:00:00
15/03/2004,02:00:00,-200.0,1224.0,66.0,,855.0,108.0,998.0,88.0,1566.0,1149.0,-200.0,-200.0,-200.0,2004-03-15 02:00:00
15/03/2004,03:00:00,-200.0,1078.0,44.0,,734.0,180.0,1128.0,109.0,1487.0,1021.0,-200.0,-200.0,-200.0,2004-03-15 03:00:00
15/03/2004,04:00:00,-200.0,1078.0,44.0,,711.0,66.0,1150.0,71.0,1468.0,1013.0,-200.0,-200.0,-200.0,2004-03-15 04:00:00
15/03/2004,05:00:00,1.0,1075.0,39.0,,703.0,88.0,1156.0,74.0,1464.0,1010.0,-200.0,-200.0,-200.0,2004-03-15 05:00:00
15/03/2004,06:00:00,-200.0,1157.0,51.0,,830.0,138.0,1030.0,80.0,1584.0,1083.0,-200.0,-200.0,-200.0,2004-03-15 06:00:00
15/03/2004,07:00:00,-200.0,1314.0,107.0,,966.0,228.0,897.0,89.0,1710.0,1235.0,-200.0,-200.0,-200.0,2004-03-15 07:00:00
15/03/2004,08:00:00,-200.0,1797.0,336.0,,1451.0,360.0,652.0,114.0,2323.0,1680.0,-200.0,-200.0,-200.0,2004-03-15 08:00:00
15/03/2004,09:00:00,-200.0,1961.0,618.0,,1701.0,478.0,537.0,149.0,2665.0,2184.0,-200.0,-200.0,-200.0,2004-03-15 09:00:00
15/03/2004,10:00:00,-200.0,1771.0,438.0,,1470.0,394.0,622.0,157.0,2262.0,1973.0,-200.0,-200.0,-200.0,2004-03-15 10:00:00
15/03/2004,11:00:00,-200.0,1564.0,334.0,,1300.0,319.0,710.0,155.0,2029.0,1798.0,-200.0,-200.0,-200.0,2004-03-15 11:00:00
15/03/2004,12:00:00,-200.0,1430.0,221.0,,1120.0,201.0,831.0,134.0,1783.0,1522.0,-200.0,-200.0,-200.0,2004-03-15 12:00:00
15/03/2004,13:00:00,-200.0,1417.0,207.0,,1146.0,171.0,830.0,119.0,1831.0,1404.0,-200.0,-200.0,-200.0,2004-03-15 13:00:00
15/03/2004,14:00:00,-200.0,1400.0,191.0,,1162.0,159.0,838.0,111.0,1829.0,1263.0,-200.0,-200.0,-200.0,2004-03-15 14:00:00
15/03/2004,15:00:00,-200.0,1317.0,185.0,,1053.0,153.0,926.0,104.0,1707.0,1137.0,-200.0,-200.0,-200.0,2004-03-15 15:00:00
15/03/2004,16:00:00,-200.0,1318.0,141.0,,1033.0,143.0,950.0,99.0,1675.0,1068.0,-200.0,-200.0,-200.0,2004-03-15 16:00:00
15/03/2004,17:00:00,-200.0,1445.0,214.0,,1141.0,156.0,857.0,110.0,1824.0,1252.0,-200.0,-200.0,-200.0,2004-03-15 17:00:00
15/03/2004,18:00:00,-200.0,1917.0,471.0,,1601.0,314.0,631.0,162.0,2447.0,1843.0,-200.0,-200.0,-200.0,2004-03-15 18:00:00
15/03/2004,19:00:00,8.0,2040.0,685.0,,1754.0,404.0,542.0,187.0,2679.0,2122.0,-200.0,-200.0,-200.0,2004-03-15 19:00:00
15/03/2004,20:00:00,-200.0,1895.0,538.0,,1573.0,320.0,565.0,165.0,2443.0,1992.0,-200.0,-200.0,-200.0,2004-03-15 20:00:00
15/03/2004,21:00:00,-200.0,1595.0,319.0,,1294.0,256.0,678.0,145.0,2058.0,1707.0,-200.0,-200.0,-200.0,2004-03-15 21:00:00
15/03/2004,22:00:00,-200.0,1439.0,224.0,,1159.0,193.0,764.0,125.0,1856.0,1494.0,-200.0,-200.0,-200.0,2004-03-15 22:00:00
15/03/2004,23:00:00,-200.0,1142.0,67.0,,852.0,89.0,1008.0,101.0,1547.0,1164.0,-200.0,-200.0,-200.0,2004-03-15 23:00:00
16/03/2004,00:00:00,-200.0,1304.0,155.0,,1019.0,127.0,852.0,103.0,1731.0,1272.0,-200.0,-200.0,-200.0,2004-03-16 00:00:00
16/03/2004,01:00:00,-200.0,1074.0,49.0,,784.0,79.0,1098.0,88.0,1483.0,1040.0,-200.0,-200.0,-200.0,2004-03-16 01:00:00
16/03/2004,02:00:00,-200.0,968.0,29.0,,640.0,43.0,1320.0,61.0,1386.0,867.0,-200.0,-200.0,-200.0,2004-03-16 02:00:00
16/03/2004,03:00:00,-200.0,929.0,25.0,,608.0,180.0,1376.0,109.0,1364.0,826.0,-200.0,-200.0,-200.0,2004-03-16 03:00:00
16/03/2004,04:00:00,-200.0,941.0,25.0,,626.0,59.0,1316.0,59.0,1373.0,840.0,-200.0,-200.0,-200.0,2004-03-16 04:00:00
16/03/2004,05:00:00,-200.0,937.0,17.0,,585.0,38.0,1412.0,52.0,1348.0,793.0,-200.0,-200.0,-200.0,2004-03-16 05:00:00
16/03/2004,06:00:00,-200.0,1017.0,27.0,,681.0,82.0,1246.0,64.0,1418.0,870.0,-200.0,-200.0,-200.0,2004-03-16 06:00:00
16/03/2004,07:00:00,-200.0,1171.0,50.0,,770.0,99.0,1162.0,70.0,1467.0,930.0,-200.0,-200.0,-200.0,2004-03-16 07:00:00
16/03/2004,08:00:00,-200.0,1541.0,218.0,,1185.0,263.0,770.0,97.0,1889.0,1407.0,-200.0,-200.0,-200.0,2004-03-16 08:00:00
16/03/2004,09:00:00,-200.0,1539.0,285.0,,1287.0,229.0,698.0,95.0,2055.0,1507.0,-200.0,-200.0,-200.0,2004-03-16 09:00:00
16/03/2004,10:00:00,-200.0,1735.0,437.0,,1431.0,396.0,628.0,150.0,2211.0,1843.0,-200.0,-200.0,-200.0,2004-03-16 10:00:00
16/03/2004,11:00:00,-200.0,1571.0,327.0,,1297.0,314.0,730.0,162.0,1973.0,1729.0,-200.0,-200.0,-200.0,2004-03-16 11:00:00
16/03/2004,12:00:00,-200.0,1452.0,283.0,,1250.0,217.0,776.0,154.0,1868.0,1583.0,-200.0,-200.0,-200.0,2004-03-16 12:00:00
16/03/2004,13:00:00,4.0,1579.0,366.0,,1359.0,252.0,724.0,161.0,1998.0,1671.0,-200.0,-200.0,-200.0,2004-03-16 13:00:00
16/03/2004,14:00:00,-200.0,1466.0,318.0,,1309.0,263.0,773.0,161.0,1897.0,1491.0,-200.0,-200.0,-200.0,2004-03-16 14:00:00
16/03/2004,15:00:00,-200.0,1280.0,228.0,,1136.0,180.0,893.0,128.0,1675.0,1240.0,-200.0,-200.0,-200.0,2004-03-16 15:00:00
16/03/2004,16:00:00,-200.0,1407.0,201.0,,1197.0,184.0,905.0,129.0,1759.0,1313.0,-200.0,-200.0,-200.0,2004-03-16 16:00:00
16/03/2004,17:00:00,-200.0,1389.0,199.0,,1173.0,190.0,898.0,133.0,1739.0,1363.0,-200.0,-200.0,-200.0,2004-03-16 17:00:00
16/03/2004,18:00:00,-200.0,1447.0,237.0,,1235.0,184.0,859.0,139.0,1778.0,1296.0,-200.0,-200.0,-200.0,2004-03-16 18:00:00
16/03/2004,19:00:00,-200.0,1551.0,261.0,,1271.0,181.0,800.0,137.0,1875.0,1432.0,-200.0,-200.0,-200.0,2004-03-16 19:00:00
16/03/2004,20:00:00,-200.0,1474.0,230.0,,1173.0,166.0,854.0,143.0,1776.0,1432.0,-200.0,-200.0,-200.0,2004-03-16 20:00:00
16/03/2004,21:00:00,-200.0,1800.0,349.0,,1426.0,317.0,700.0,177.0,2106.0,2034.0,-200.0,-200.0,-200.0,2004-03-16 21:00:00
16/03/2004,22:00:00,-200.0,1379.0,183.0,,1101.0,184.0,818.0,138.0,1710.0,1602.0,-200.0,-200.0,-200.0,2004-03-16 22:00:00
16/03/2004,23:00:00,-200.0,1201.0,88.0,,943.0,130.0,935.0,117.0,1560.0,1362.0,-200.0,-200.0,-200.0,2004-03-16 23:00:00
17/03/2004,00:00:00,-200.0,1205.0,85.0,,925.0,132.0,922.0,107.0,1547.0,1314.0,-200.0,-200.0,-200.0,2004-03-17 00:00:00
17/03/2004,01:00:00,-200.0,1072.0,47.0,,784.0,95.0,1066.0,90.0,1442.0,1114.0,-200.0,-200.0,-200.0,2004-03-17 01:00:00
17/03/2004,02:00:00,-200.0,998.0,34.0,,714.0,70.0,1169.0,79.0,1383.0,992.0,-200.0,-200.0,-200.0,2004-03-17 02:00:00
17/03/2004,03:00:00,-200.0,933.0,26.0,,625.0,180.0,1292.0,109.0,1332.0,884.0,-200.0,-200.0,-200.0,2004-03-17 03:00:00
17/03/2004,04:00:00,-200.0,883.0,17.0,,577.0,54.0,1396.0,60.0,1303.0,808.0,-200.0,-200.0,-200.0,2004-03-17 04:00:00
17/03/2004,05:00:00,-200.0,869.0,11.0,,554.0,28.0,1460.0,40.0,1268.0,667.0,-200.0,-200.0,-200.0,2004-03-17 05:00:00
17/03/2004,06:00:00,-200.0,891.0,18.0,,576.0,46.0,1417.0,53.0,1289.0,733.0,-200.0,-200.0,-200.0,2004-03-17 06:00:00
17/03/2004,07:00:00,-200.0,1173.0,84.0,,878.0,160.0,1038.0,84.0,1556.0,1052.0,-200.0,-200.0,-200.0,2004-03-17 07:00:00
17/03/2004,08:00:00,-200.0,1587.0,260.0,,1334.0,320.0,702.0,108.0,1999.0,1534.0,-200.0,-200.0,-200.0,2004-03-17 08:00:00
17/03/2004,09:00:00,-200.0,1852.0,534.0,,1696.0,377.0,553.0,127.0,2535.0,1931.0,-200.0,-200.0,-200.0,2004-03-17 09:00:00
17/03/2004,10:00:00,-200.0,1522.0,368.0,,1331.0,280.0,703.0,134.0,2026.0,1734.0,-200.0,-200.0,-200.0,2004-03-17 10:00:00
17/03/2004,11:00:00,-200.0,1438.0,200.0,,1161.0,221.0,819.0,135.0,1782.0,1595.0,-200.0,-200.0,-200.0,2004-03-17 11:00:00
17/03/2004,12:00:00,-200.0,1393.0,145.0,,1067.0,210.0,905.0,142.0,1654.0,1490.0,-200.0,-200.0,-200.0,2004-03-17 12:00:00
17/03/2004,13:00:00,-200.0,1452.0,188.0,,1152.0,204.0,861.0,153.0,1747.0,1508.0,-200.0,-200.0,-200.0,2004-03-17 13:00:00
17/03/2004,14:00:00,-200.0,1389.0,152.0,,1108.0,161.0,887.0,123.0,1712.0,1334.0,-200.0,-200.0,-200.0,2004-03-17 14:00:00
17/03/2004,15:00:00,2.0,1207.0,103.0,,994.0,135.0,1013.0,104.0,1520.0,1045.0,-200.0,-200.0,-200.0,2004-03-17 15:00:00
17/03/2004,16:00:00,-200.0,1365.0,193.0,,1154.0,186.0,940.0,129.0,1679.0,1221.0,-200.0,-200.0,-200.0,2004-03-17 16:00:00
17/03/2004,17:00:00,-200.0,1247.0,134.0,,1060.0,147.0,1032.0,114.0,1525.0,1069.0,-200.0,-200.0,-200.0,2004-03-17 17:00:00
17/03/2004,18:00:00,5.0,1557.0,386.0,,1478.0,299.0,793.0,158.0,1981.0,1569.0,-200.0,-200.0,-200.0,2004-03-17 18:00:00
17/03/2004,19:00:00,-200.0,1973.0,577.0,,1737.0,411.0,617.0,194.0,2414.0,2306.0,-200.0,-200.0,-200.0,2004-03-17 19:00:00
17/03/2004,20:00:00,-200.0,1975.0,523.0,,1667.0,347.0,597.0,182.0,2416.0,2359.0,-200.0,-200.0,-200.0,2004-03-17 20:00:00
17/03/2004,21:00:00,-200.0,1795.0,472.0,,1485.0,336.0,653.0,180.0,2174.0,2050.0,-200.0,-200.0,-200.0,2004-03-17 21:00:00
17/03/2004,22:00:00,-200.0,1444.0,206.0,,1150.0,202.0,770.0,136.0,1727.0,1727.0,-200.0,-200.0,-200.0,2004-03-17 22:00:00
17/03/2004,23:00:00,-200.0,1488.0,216.0,,1171.0,178.0,731.0,127.0,1778.0,1705.0,-200.0,-200.0,-200.0,2004-03-17 23:00:00
18/03/2004,00:00:00,-200.0,1371.0,159.0,,1083.0,154.0,796.0,116.0,1669.0,1551.0,-200.0,-200.0,-200.0,2004-03-18 00:00:00
18/03/2004,01:00:00,-200.0,1161.0,70.0,,904.0,92.0,947.0,107.0,1502.0,1240.0,-200.0,-200.0,-200.0,2004-03-18 01:00:00
18/03/2004,02:00:00,1.0,1064.0,44.0,,787.0,61.0,1057.0,88.0,1407.0,1115.0,-200.0,-200.0,-200.0,2004-03-18 02:00:00
18/03/2004,03:00:00,-200.0,970.0,42.0,,687.0,180.0,1196.0,109.0,1351.0,969.0,-200.0,-200.0,-200.0,2004-03-18 03:00:00
18/03/2004,04:00:00,-200.0,954.0,28.0,,645.0,60.0,1260.0,78.0,1334.0,925.0,-200.0,-200.0,-200.0,2004-03-18 04:00:00
18/03/2004,05:00:00,-200.0,931.0,20.0,,623.0,37.0,1293.0,57.0,1307.0,828.0,-200.0,-200.0,-200.0,2004-03-18 05:00:00
18/03/2004,06:00:00,-200.0,938.0,26.0,,650.0,68.0,1251.0,71.0,1333.0,893.0,-200.0,-200.0,-200.0,2004-03-18 06:00:00
18/03/2004,07:00:00,-200.0,1166.0,78.0,,885.0,139.0,1005.0,85.0,1551.0,1075.0,-200.0,-200.0,-200.0,2004-03-18 07:00:00
18/03/2004,08:00:00,-200.0,1643.0,319.0,,1384.0,339.0,667.0,124.0,2094.0,1610.0,-200.0,-200.0,-200.0,2004-03-18 08:00:00
18/03/2004,09:00:00,-200.0,1934.0,506.0,,1682.0,421.0,541.0,151.0,2468.0,2051.0,-200.0,-200.0,-200.0,2004-03-18 09:00:00
18/03/2004,10:00:00,-200.0,1617.0,150.0,,1333.0,349.0,686.0,150.0,2010.0,1819.0,-200.0,-200.0,-200.0,2004-03-18 10:00:00
18/03/2004,11:00:00,-200.0,1473.0,150.0,,1127.0,224.0,831.0,152.0,1752.0,1568.0,-200.0,-200.0,-200.0,2004-03-18 11:00:00
18/03/2004,12:00:00,-200.0,1379.0,150.0,,1068.0,171.0,899.0,139.0,1663.0,1374.0,-200.0,-200.0,-200.0,2004-03-18 12:00:00
18/03/2004,13:00:00,-200.0,1385.0,150.0,,1056.0,149.0,891.0,133.0,1648.0,1268.0,-200.0,-200.0,-200.0,2004-03-18 13:00:00
18/03/2004,14:00:00,-200.0,1379.0,150.0,,1087.0,137.0,901.0,126.0,1660.0,1144.0,-200.0,-200.0,-200.0,2004-03-18 14:00:00
18/03/2004,15:00:00,-200.0,1322.0,150.0,,1129.0,149.0,934.0,128.0,1639.0,1109.0,-200.0,-200.0,-200.0,2004-03-18 15:00:00
18/03/2004,16:00:00,-200.0,1496.0,150.0,,1205.0,172.0,822.0,169.0,1767.0,1347.0,-200.0,-200.0,-200.0,2004-03-18 16:00:00
18/03/2004,17:00:00,-200.0,1409.0,150.0,,1131.0,166.0,873.0,149.0,1689.0,1206.0,-200.0,-200.0,-200.0,2004-03-18 17:00:00
18/03/2004,18:00:00,-200.0,1513.0,150.0,,1338.0,214.0,764.0,156.0,1957.0,1397.0,-200.0,-200.0,-200.0,2004-03-18 18:00:00
18/03/2004,19:00:00,-200.0,1667.0,150.0,,1464.0,280.0,683.0,168.0,2118.0,1588.0,-200.0,-200.0,-200.0,2004-03-18 19:00:00
18/03/2004,20:00:00,-200.0,1667.0,150.0,,1453.0,276.0,684.0,176.0,2051.0,1569.0,-200.0,-200.0,-200.0,2004-03-18 20:00:00
18/03/2004,21:00:00,-200.0,1430.0,150.0,,1121.0,178.0,814.0,135.0,1732.0,1322.0,-200.0,-200.0,-200.0,2004-03-18 21:00:00
18/03/2004,22:00:00,-200.0,1333.0,150.0,,989.0,129.0,885.0,121.0,1621.0,1194.0,-200.0,-200.0,-200.0,2004-03-18 22:00:00
18/03/2004,23:00:00,-200.0,1262.0,150.0,,911.0,95.0,948.0,99.0,1545.0,1062.0,-200.0,-200.0,-200.0,2004-03-18 23:00:00
19/03/2004,00:00:00,2.0,1287.0,150.0,,936.0,126.0,918.0,106.0,1606.0,1040.0,-200.0,-200.0,-200.0,2004-03-19 00:00:00
19/03/2004,01:00:00,-200.0,1134.0,150.0,,840.0,103.0,1021.0,96.0,1501.0,917.0,-200.0,-200.0,-200.0,2004-03-19 01:00:00
19/03/2004,02:00:00,-200.0,999.0,150.0,,688.0,48.0,1229.0,63.0,1380.0,594.0,-200.0,-200.0,-200.0,2004-03-19 02:00:00
19/03/2004,03:00:00,-200.0,961.0,150.0,,622.0,180.0,1382.0,109.0,1301.0,430.0,-200.0,-200.0,-200.0,2004-03-19 03:00:00
19/03/2004,04:00:00,-200.0,934.0,150.0,,569.0,20.0,1440.0,32.0,1280.0,397.0,-200.0,-200.0,-200.0,2004-03-19 04:00:00
19/03/2004,05:00:00,-200.0,913.0,150.0,,525.0,18.0,1620.0,28.0,1260.0,370.0,-200.0,-200.0,-200.0,2004-03-19 05:00:00
19/03/2004,06:00:00,-200.0,969.0,150.0,,607.0,56.0,1373.0,61.0,1324.0,438.0,-200.0,-200.0,-200.0,2004-03-19 06:00:00
19/03/2004,07:00:00,-200.0,1182.0,150.0,,845.0,115.0,1054.0,99.0,1539.0,704.0,-200.0,-200.0,-200.0,2004-03-19 07:00:00
19/03/2004,08:00:00,-200.0,1740.0,150.0,,1372.0,320.0,671.0,157.0,2144.0,1476.0,-200.0,-200.0,-200.0,2004-03-19 08:00:00
19/03/2004,09:00:00,-200.0,1819.0,150.0,,1582.0,357.0,575.0,166.0,2456.0,1716.0,-200.0,-200.0,-200.0,2004-03-19 09:00:00
19/03/2004,10:00:00,4.0,1427.0,150.0,,1275.0,253.0,701.0,149.0,1980.0,1398.0,-200.0,-200.0,-200.0,2004-03-19 10:00:00
19/03/2004,11:00:00,-200.0,1390.0,150.0,,1191.0,218.0,759.0,135.0,1879.0,1268.0,-200.0,-200.0,-200.0,2004-03-19 11:00:00
19/03/2004,12:00:00,-200.0,1283.0,150.0,,1117.0,192.0,813.0,127.0,1751.0,1188.0,-200.0,-200.0,-200.0,2004-03-19 12:00:00
19/03/2004,13:00:00,3.0,1304.0,150.0,,1157.0,176.0,793.0,122.0,1801.0,1171.0,-200.0,-200.0,-200.0,2004-03-19 13:00:00
19/03/2004,14:00:00,-200.0,1364.0,150.0,,1202.0,198.0,771.0,135.0,1875.0,1250.0,-200.0,-200.0,-200.0,2004-03-19 14:00:00
19/03/2004,15:00:00,-200.0,1410.0,150.0,,1268.0,212.0,724.0,139.0,1957.0,1344.0,-200.0,-200.0,-200.0,2004-03-19 15:00:00
19/03/2004,16:00:00,4.0,1476.0,150.0,,1280.0,249.0,708.0,147.0,1955.0,1378.0,-200.0,-200.0,-200.0,2004-03-19 16:00:00
19/03/2004,17:00:00,-200.0,1522.0,150.0,,1320.0,270.0,690.0,158.0,2005.0,1435.0,-200.0,-200.0,-200.0,2004-03-19 17:00:00
19/03/2004,18:00:00,-200.0,1442.0,150.0,,1301.0,231.0,704.0,146.0,1952.0,1372.0,-200.0,-200.0,-200.0,2004-03-19 18:00:00
19/03/2004,19:00:00,-200.0,1469.0,150.0,,1344.0,251.0,677.0,144.0,1997.0,1471.0,-200.0,-200.0,-200.0,2004-03-19 19:00:00
19/03/2004,20:00:00,-200.0,1467.0,150.0,,1292.0,210.0,698.0,138.0,1942.0,1439.0,-200.0,-200.0,-200.0,2004-03-19 20:00:00
19/03/2004,21:00:00,4.0,1421.0,150.0,,1202.0,249.0,748.0,143.0,1854.0,1429.0,-200.0,-200.0,-200.0,2004-03-19 21:00:00
19/03/2004,22:00:00,-200.0,1175.0,150.0,,945.0,143.0,904.0,116.0,1604.0,1081.0,-200.0,-200.0,-200.0,2004-03-19 22:00:00
19/03/2004,23:00:00,-200.0,1215.0,150.0,,912.0,127.0,948.0,109.0,1547.0,993.0,-200.0,-200.0,-200.0,2004-03-19 23:00:00
20/03/2004,00:00:00,-200.0,1127.0,150.0,,802.0,104.0,1064.0,92.0,1447.0,837.0,-200.0,-200.0,-200.0,2004-03-20 00:00:00
20/03/2004,01:00:00,-200.0,1090.0,150.0,,773.0,86.0,1105.0,83.0,1429.0,761.0,-200.0,-200.0,-200.0,2004-03-20 01:00:00
20/03/2004,02:00:00,-200.0,1017.0,150.0,,718.0,74.0,1182.0,81.0,1382.0,650.0,-200.0,-200.0,-200.0,2004-03-20 02:00:00
20/03/2004,03:00:00,-200.0,997.0,150.0,,677.0,180.0,1252.0,109.0,1359.0,591.0,-200.0,-200.0,-200.0,2004-03-20 03:00:00
20/03/2004,04:00:00,-200.0,945.0,150.0,,646.0,44.0,1308.0,55.0,1332.0,505.0,-200.0,-200.0,-200.0,2004-03-20 04:00:00
20/03/2004,05:00:00,-200.0,956.0,150.0,,661.0,42.0,1260.0,53.0,1351.0,518.0,-200.0,-200.0,-200.0,2004-03-20 05:00:00
20/03/2004,06:00:00,-200.0,966.0,150.0,,622.0,63.0,1317.0,67.0,1342.0,571.0,-200.0,-200.0,-200.0,2004-03-20 06:00:00
20/03/2004,07:00:00,-200.0,1064.0,150.0,,728.0,115.0,1161.0,91.0,1461.0,842.0,-200.0,-200.0,-200.0,2004-03-20 07:00:00
20/03/2004,08:00:00,-200.0,1300.0,150.0,,935.0,170.0,902.0,113.0,1623.0,1145.0,-200.0,-200.0,-200.0,2004-03-20 08:00:00
20/03/2004,09:00:00,-200.0,1348.0,150.0,,998.0,147.0,834.0,102.0,1689.0,1218.0,-200.0,-200.0,-200.0,2004-03-20 09:00:00
20/03/2004,10:00:00,-200.0,1425.0,150.0,,1068.0,166.0,776.0,107.0,1764.0,1341.0,-200.0,-200.0,-200.0,2004-03-20 10:00:00
20/03/2004,11:00:00,-200.0,1474.0,150.0,,1061.0,195.0,768.0,113.0,1768.0,1406.0,-200.0,-200.0,-200.0,2004-03-20 11:00:00
20/03/2004,12:00:00,-200.0,1490.0,150.0,,1039.0,182.0,782.0,108.0,1757.0,1422.0,-200.0,-200.0,-200.0,2004-03-20 12:00:00
20/03/2004,13:00:00,-200.0,1495.0,150.0,,1040.0,168.0,809.0,105.0,1735.0,1373.0,-200.0,-200.0,-200.0,2004-03-20 13:00:00
20/03/2004,14:00:00,-200.0,1376.0,150.0,,953.0,125.0,900.0,93.0,1636.0,1153.0,-200.0,-200.0,-200.0,2004-03-20 14:00:00
20/03/2004,15:00:00,-200.0,1305.0,150.0,,884.0,95.0,980.0,87.0,1573.0,927.0,-200.0,-200.0,-200.0,2004-03-20 15:00:00
20/03/2004,16:00:00,-200.0,1283.0,150.0,,844.0,79.0,1036.0,76.0,1539.0,766.0,-200.0,-200.0,-200.0,2004-03-20 16:00:00
20/03/2004,17:00:00,-200.0,1392.0,150.0,,967.0,119.0,930.0,94.0,1649.0,941.0,-200.0,-200.0,-200.0,2004-03-20 17:00:00
20/03/2004,18:00:00,-200.0,1452.0,150.0,,1063.0,142.0,856.0,110.0,1774.0,1146.0,-200.0,-200.0,-200.0,2004-03-20 18:00:00
20/03/2004,19:00:00,-200.0,1633.0,150.0,,1199.0,215.0,734.0,136.0,1919.0,1417.0,-200.0,-200.0,-200.0,2004-03-20 19:00:00
20/03/2004,20:00:00,-200.0,1625.0,150.0,,1191.0,229.0,733.0,139.0,1885.0,1442.0,-200.0,-200.0,-200.0,2004-03-20 20:00:00
20/03/2004,21:00:00,-200.0,1535.0,150.0,,1108.0,206.0,785.0,125.0,1820.0,1323.0,-200.0,-200.0,-200.0,2004-03-20 21:00:00
20/03/2004,22:00:00,-200.0,1323.0,150.0,,973.0,147.0,864.0,111.0,1712.0,1125.0,-200.0,-200.0,-200.0,2004-03-20 22:00:00
20/03/2004,23:00:00,-200.0,1309.0,150.0,,937.0,122.0,905.0,97.0,1672.0,1036.0,-200.0,-200.0,-200.0,2004-03-20 23:00:00
21/03/2004,00:00:00,-200.0,1456.0,150.0,,999.0,175.0,835.0,107.0,1714.0,1202.0,-200.0,-200.0,-200.0,2004-03-21 00:00:00
21/03/2004,01:00:00,-200.0,1300.0,150.0,,872.0,133.0,941.0,90.0,1577.0,1054.0,-200.0,-200.0,-200.0,2004-03-21 01:00:00
21/03/2004,02:00:00,-200.0,1203.0,150.0,,823.0,89.0,1004.0,84.0,1526.0,903.0,-200.0,-200.0,-200.0,2004-03-21 02:00:00
21/03/2004,03:00:00,-200.0,1195.0,150.0,,836.0,180.0,987.0,109.0,1554.0,885.0,-200.0,-200.0,-200.0,2004-03-21 03:00:00
21/03/2004,04:00:00,-200.0,1117.0,150.0,,802.0,85.0,1029.0,87.0,1539.0,818.0,-200.0,-200.0,-200.0,2004-03-21 04:00:00
21/03/2004,05:00:00,-200.0,1062.0,150.0,,711.0,55.0,1136.0,66.0,1461.0,700.0,-200.0,-200.0,-200.0,2004-03-21 05:00:00
21/03/2004,06:00:00,-200.0,947.0,150.0,,594.0,24.0,1300.0,36.0,1390.0,580.0,-200.0,-200.0,-200.0,2004-03-21 06:00:00
21/03/2004,07:00:00,-200.0,1065.0,150.0,,687.0,72.0,1143.0,62.0,1492.0,815.0,-200.0,-200.0,-200.0,2004-03-21 07:00:00
21/03/2004,08:00:00,-200.0,1155.0,150.0,,734.0,122.0,1062.0,91.0,1528.0,1035.0,-200.0,-200.0,-200.0,2004-03-21 08:00:00
21/03/2004,09:00:00,-200.0,1220.0,150.0,,782.0,111.0,996.0,89.0,1560.0,1067.0,-200.0,-200.0,-200.0,2004-03-21 09:00:00
21/03/2004,10:00:00,-200.0,1301.0,150.0,,862.0,123.0,914.0,93.0,1633.0,1114.0,-200.0,-200.0,-200.0,2004-03-21 10:00:00
21/03/2004,11:00:00,-200.0,1279.0,150.0,,870.0,106.0,911.0,81.0,1646.0,1000.0,-200.0,-200.0,-200.0,2004-03-21 11:00:00
21/03/2004,12:00:00,-200.0,1267.0,150.0,,883.0,103.0,953.0,82.0,1617.0,906.0,-200.0,-200.0,-200.0,2004-03-21 12:00:00
21/03/2004,13:00:00,-200.0,1239.0,150.0,,848.0,102.0,981.0,80.0,1568.0,822.0,-200.0,-200.0,-200.0,2004-03-21 13:00:00
21/03/2004,14:00:00,-200.0,1128.0,150.0,,742.0,48.0,1144.0,48.0,1507.0,610.0,-200.0,-200.0,-200.0,2004-03-21 14:00:00
21/03/2004,15:00:00,-200.0,1243.0,150.0,,916.0,63.0,962.0,61.0,1669.0,657.0,-200.0,-200.0,-200.0,2004-03-21 15:00:00
21/03/2004,16:00:00,-200.0,1208.0,150.0,,853.0,98.0,1060.0,89.0,1506.0,647.0,-200.0,-200.0,-200.0,2004-03-21 16:00:00
21/03/2004,17:00:00,-200.0,1306.0,150.0,,938.0,132.0,961.0,105.0,1607.0,762.0,-200.0,-200.0,-200.0,2004-03-21 17:00:00
21/03/2004,18:00:00,-200.0,1546.0,150.0,,1151.0,173.0,769.0,116.0,1874.0,1122.0,-200.0,-200.0,-200.0,2004-03-21 18:00:00
21/03/2004,19:00:00,-200.0,1501.0,150.0,,1071.0,185.0,823.0,119.0,1744.0,1130.0,-200.0,-200.0,-200.0,2004-03-21 19:00:00
21/03/2004,20:00:00,-200.0,1605.0,150.0,,1153.0,266.0,769.0,144.0,1840.0,1637.0,-200.0,-200.0,-200.0,2004-03-21 20:00:00
21/03/2004,21:00:00,-200.0,1316.0,150.0,,974.0,188.0,883.0,123.0,1673.0,1272.0,-200.0,-200.0,-200.0,2004-03-21 21:00:00
21/03/2004,22:00:00,-200.0,1195.0,150.0,,898.0,122.0,933.0,105.0,1594.0,1098.0,-200.0,-200.0,-200.0,2004-03-21 22:00:00
21/03/2004,23:00:00,-200.0,1211.0,150.0,,896.0,112.0,920.0,93.0,1624.0,1066.0,-200.0,-200.0,-200.0,2004-03-21 23:00:00
22/03/2004,00:00:00,-200.0,1161.0,150.0,,815.0,93.0,995.0,86.0,1582.0,909.0,-200.0,-200.0,-200.0,2004-03-22 00:00:00
22/03/2004,01:00:00,-200.0,1095.0,150.0,,767.0,74.0,1050.0,76.0,1547.0,818.0,-200.0,-200.0,-200.0,2004-03-22 01:00:00
22/03/2004,02:00:00,-200.0,897.0,150.0,,563.0,23.0,1417.0,33.0,1355.0,472.0,-200.0,-200.0,-200.0,2004-03-22 02:00:00
22/03/2004,03:00:00,-200.0,842.0,150.0,,468.0,180.0,1813.0,109.0,1274.0,394.0,-200.0,-200.0,-200.0,2004-03-22 03:00:00
22/03/2004,04:00:00,-200.0,854.0,150.0,,481.0,17.0,1756.0,27.0,1304.0,396.0,-200.0,-200.0,-200.0,2004-03-22 04:00:00
22/03/2004,05:00:00,-200.0,845.0,150.0,,472.0,15.0,1786.0,23.0,1278.0,378.0,-200.0,-200.0,-200.0,2004-03-22 05:00:00
22/03/2004,06:00:00,-200.0,942.0,150.0,,586.0,41.0,1480.0,46.0,1373.0,432.0,-200.0,-200.0,-200.0,2004-03-22 06:00:00
22/03/2004,07:00:00,-200.0,1090.0,150.0,,768.0,86.0,1072.0,76.0,1538.0,699.0,-200.0,-200.0,-200.0,2004-03-22 07:00:00
22/03/2004,08:00:00,-200.0,1514.0,150.0,,1230.0,226.0,732.0,116.0,1996.0,1252.0,-200.0,-200.0,-200.0,2004-03-22 08:00:00
22/03/2004,09:00:00,-200.0,1379.0,150.0,,1252.0,214.0,711.0,115.0,1962.0,1237.0,-200.0,-200.0,-200.0,2004-03-22 09:00:00
22/03/2004,10:00:00,-200.0,1074.0,150.0,,854.0,115.0,1032.0,83.0,1484.0,772.0,-200.0,-200.0,-200.0,2004-03-22 10:00:00
22/03/2004,11:00:00,-200.0,1090.0,150.0,,868.0,124.0,1026.0,87.0,1509.0,766.0,-200.0,-200.0,-200.0,2004-03-22 11:00:00
22/03/2004,12:00:00,-200.0,1110.0,150.0,,964.0,122.0,947.0,90.0,1577.0,829.0,-200.0,-200.0,-200.0,2004-03-22 12:00:00
22/03/2004,13:00:00,2.0,1102.0,150.0,,994.0,107.0,955.0,87.0,1599.0,783.0,-200.0,-200.0,-200.0,2004-03-22 13:00:00
22/03/2004,14:00:00,-200.0,1100.0,150.0,,1021.0,133.0,952.0,99.0,1607.0,822.0,-200.0,-200.0,-200.0,2004-03-22 14:00:00
22/03/2004,15:00:00,-200.0,1094.0,150.0,,1003.0,130.0,965.0,99.0,1574.0,813.0,-200.0,-200.0,-200.0,2004-03-22 15:00:00
22/03/2004,16:00:00,-200.0,1076.0,451.0,,1034.0,150.0,964.0,101.0,1544.0,813.0,-200.0,-200.0,-200.0,2004-03-22 16:00:00
22/03/2004,17:00:00,-200.0,1152.0,185.0,,1062.0,138.0,928.0,103.0,1606.0,850.0,-200.0,-200.0,-200.0,2004-03-22 17:00:00
22/03/2004,18:00:00,-200.0,1407.0,426.0,,1249.0,213.0,720.0,129.0,1932.0,1276.0,-200.0,-200.0,-200.0,2004-03-22 18:00:00
22/03/2004,19:00:00,-200.0,1438.0,672.0,,1325.0,232.0,678.0,143.0,1993.0,1401.0,-200.0,-200.0,-200.0,2004-03-22 19:00:00
22/03/2004,20:00:00,-200.0,1425.0,624.0,,1325.0,238.0,678.0,146.0,1965.0,1356.0,-200.0,-200.0,-200.0,2004-03-22 20:00:00
22/03/2004,21:00:00,-200.0,1279.0,325.0,,1131.0,180.0,775.0,124.0,1758.0,1243.0,-200.0,-200.0,-200.0,2004-03-22 21:00:00
22/03/2004,22:00:00,2.0,1132.0,143.0,,916.0,128.0,920.0,113.0,1561.0,1083.0,-200.0,-200.0,-200.0,2004-03-22 22:00:00
22/03/2004,23:00:00,-200.0,1006.0,89.0,,729.0,65.0,1142.0,80.0,1370.0,795.0,-200.0,-200.0,-200.0,2004-03-22 23:00:00
23/03/2004,00:00:00,-200.0,982.0,73.0,,700.0,53.0,1204.0,72.0,1359.0,735.0,-200.0,-200.0,-200.0,2004-03-23 00:00:00
23/03/2004,01:00:00,-200.0,969.0,48.0,,636.0,47.0,1271.0,64.0,1309.0,684.0,-200.0,-200.0,-200.0,2004-03-23 01:00:00
23/03/2004,02:00:00,-200.0,941.0,47.0,,621.0,51.0,1298.0,70.0,1330.0,714.0,-200.0,-200.0,-200.0,2004-03-23 02:00:00
23/03/2004,03:00:00,-200.0,892.0,36.0,,522.0,180.0,1522.0,109.0,1285.0,456.0,-200.0,-200.0,-200.0,2004-03-23 03:00:00
23/03/2004,04:00:00,-200.0,855.0,25.0,,478.0,20.0,1701.0,31.0,1261.0,401.0,-200.0,-200.0,-200.0,2004-03-23 04:00:00
23/03/2004,05:00:00,-200.0,834.0,19.0,,459.0,13.0,1908.0,22.0,1212.0,361.0,-200.0,-200.0,-200.0,2004-03-23 05:00:00
23/03/2004,06:00:00,-200.0,909.0,26.0,,567.0,33.0,1542.0,47.0,1287.0,418.0,-200.0,-200.0,-200.0,2004-03-23 06:00:00
23/03/2004,07:00:00,-200.0,1061.0,60.0,,745.0,103.0,1178.0,88.0,1429.0,616.0,-200.0,-200.0,-200.0,2004-03-23 07:00:00
23/03/2004,08:00:00,3.0,1441.0,248.0,,1124.0,224.0,851.0,130.0,1829.0,1089.0,-200.0,-200.0,-200.0,2004-03-23 08:00:00
23/03/2004,09:00:00,-200.0,1498.0,535.0,,1325.0,244.0,684.0,132.0,2095.0,1329.0,-200.0,-200.0,-200.0,2004-03-23 09:00:00
23/03/2004,10:00:00,-200.0,1343.0,340.0,,1185.0,237.0,760.0,132.0,1857.0,1311.0,-200.0,-200.0,-200.0,2004-03-23 10:00:00
23/03/2004,11:00:00,3.0,1308.0,325.0,,1166.0,220.0,792.0,131.0,1794.0,1236.0,-200.0,-200.0,-200.0,2004-03-23 11:00:00
23/03/2004,12:00:00,-200.0,1209.0,267.0,,1097.0,207.0,837.0,129.0,1746.0,1147.0,-200.0,-200.0,-200.0,2004-03-23 12:00:00
23/03/2004,13:00:00,-200.0,1310.0,325.0,,1207.0,208.0,770.0,132.0,1847.0,1301.0,-200.0,-200.0,-200.0,2004-03-23 13:00:00
23/03/2004,14:00:00,-200.0,1171.0,268.0,,1064.0,160.0,881.0,110.0,1639.0,1097.0,-200.0,-200.0,-200.0,2004-03-23 14:00:00
23/03/2004,15:00:00,-200.0,1112.0,136.0,,980.0,131.0,924.0,99.0,1589.0,900.0,-200.0,-200.0,-200.0,2004-03-23 15:00:00
23/03/2004,16:00:00,2.0,1132.0,118.0,,927.0,128.0,944.0,100.0,1570.0,781.0,-200.0,-200.0,-200.0,2004-03-23 16:00:00
23/03/2004,17:00:00,3.0,1225.0,276.0,,1111.0,176.0,818.0,122.0,1719.0,1013.0,-200.0,-200.0,-200.0,2004-03-23 17:00:00
23/03/2004,18:00:00,-200.0,1065.0,151.0,,953.0,107.0,962.0,97.0,1514.0,790.0,-200.0,-200.0,-200.0,2004-03-23 18:00:00
23/03/2004,19:00:00,-200.0,1236.0,236.0,,1084.0,131.0,854.0,112.0,1688.0,1059.0,-200.0,-200.0,-200.0,2004-03-23 19:00:00
23/03/2004,20:00:00,-200.0,1309.0,220.0,,1126.0,166.0,812.0,128.0,1722.0,1205.0,-200.0,-200.0,-200.0,2004-03-23 20:00:00
23/03/2004,21:00:00,-200.0,1089.0,87.0,,884.0,89.0,1006.0,101.0,1487.0,975.0,-200.0,-200.0,-200.0,2004-03-23 21:00:00
23/03/2004,22:00:00,-200.0,1000.0,81.0,,776.0,81.0,1141.0,96.0,1375.0,896.0,-200.0,-200.0,-200.0,2004-03-23 22:00:00
23/03/2004,23:00:00,-200.0,1041.0,74.0,,782.0,78.0,1105.0,86.0,1425.0,911.0,-200.0,-200.0,-200.0,2004-03-23 23:00:00
24/03/2004,00:00:00,-200.0,1045.0,55.0,,756.0,70.0,1137.0,85.0,1411.0,902.0,-200.0,-200.0,-200.0,2004-03-24 00:00:00
24/03/2004,01:00:00,-200.0,997.0,74.0,,744.0,76.0,1151.0,79.0,1405.0,832.0,-200.0,-200.0,-200.0,2004-03-24 01:00:00
24/03/2004,02:00:00,-200.0,948.0,35.0,,634.0,43.0,1320.0,61.0,1326.0,715.0,-200.0,-200.0,-200.0,2004-03-24 02:00:00
24/03/2004,03:00:00,-200.0,878.0,29.0,,551.0,180.0,1493.0,109.0,1272.0,683.0,-200.0,-200.0,-200.0,2004-03-24 03:00:00
24/03/2004,04:00:00,-200.0,908.0,29.0,,559.0,44.0,1477.0,66.0,1287.0,721.0,-200.0,-200.0,-200.0,2004-03-24 04:00:00
24/03/2004,05:00:00,-200.0,892.0,20.0,,522.0,34.0,1572.0,54.0,1255.0,648.0,-200.0,-200.0,-200.0,2004-03-24 05:00:00
24/03/2004,06:00:00,-200.0,954.0,32.0,,561.0,43.0,1496.0,57.0,1255.0,612.0,-200.0,-200.0,-200.0,2004-03-24 06:00:00
24/03/2004,07:00:00,-200.0,1045.0,84.0,,751.0,79.0,1186.0,75.0,1403.0,800.0,-200.0,-200.0,-200.0,2004-03-24 07:00:00
24/03/2004,08:00:00,-200.0,1383.0,245.0,,1109.0,174.0,832.0,97.0,1706.0,1173.0,-200.0,-200.0,-200.0,2004-03-24 08:00:00
24/03/2004,09:00:00,-200.0,1597.0,553.0,,1395.0,235.0,652.0,110.0,2080.0,1519.0,-200.0,-200.0,-200.0,2004-03-24 09:00:00
24/03/2004,10:00:00,-200.0,1318.0,450.0,,1124.0,218.0,762.0,113.0,1770.0,1287.0,-200.0,-200.0,-200.0,2004-03-24 10:00:00
24/03/2004,11:00:00,-200.0,1138.0,118.0,,898.0,136.0,950.0,88.0,1505.0,966.0,-200.0,-200.0,-200.0,2004-03-24 11:00:00
24/03/2004,12:00:00,-200.0,1098.0,118.0,,842.0,117.0,1012.0,85.0,1440.0,828.0,-200.0,-200.0,-200.0,2004-03-24 12:00:00
24/03/2004,13:00:00,-200.0,1118.0,144.0,,927.0,119.0,959.0,96.0,1477.0,825.0,-200.0,-200.0,-200.0,2004-03-24 13:00:00
24/03/2004,14:00:00,-200.0,1170.0,159.0,,1009.0,126.0,879.0,106.0,1566.0,872.0,-200.0,-200.0,-200.0,2004-03-24 14:00:00
24/03/2004,15:00:00,-200.0,1112.0,122.0,,842.0,100.0,1015.0,91.0,1494.0,680.0,-200.0,-200.0,-200.0,2004-03-24 15:00:00
24/03/2004,16:00:00,-200.0,1390.0,230.0,,1028.0,197.0,829.0,126.0,1730.0,1002.0,-200.0,-200.0,-200.0,2004-03-24 16:00:00
24/03/2004,17:00:00,-200.0,1353.0,320.0,,1096.0,195.0,774.0,130.0,1783.0,1159.0,-200.0,-200.0,-200.0,2004-03-24 17:00:00
24/03/2004,18:00:00,-200.0,1260.0,263.0,,1050.0,156.0,828.0,111.0,1722.0,979.0,-200.0,-200.0,-200.0,2004-03-24 18:00:00
24/03/2004,19:00:00,-200.0,1501.0,556.0,,1302.0,247.0,681.0,134.0,2008.0,1311.0,-200.0,-200.0,-200.0,2004-03-24 19:00:00
24/03/2004,20:00:00,-200.0,1273.0,458.0,,1130.0,190.0,795.0,136.0,1744.0,1071.0,-200.0,-200.0,-200.0,2004-03-24 20:00:00
24/03/2004,21:00:00,-200.0,1179.0,214.0,,955.0,169.0,928.0,125.0,1571.0,899.0,-200.0,-200.0,-200.0,2004-03-24 21:00:00
24/03/2004,22:00:00,-200.0,1047.0,97.0,,809.0,118.0,1064.0,108.0,1435.0,766.0,-200.0,-200.0,-200.0,2004-03-24 22:00:00
24/03/2004,23:00:00,-200.0,973.0,79.0,,739.0,81.0,1186.0,87.0,1354.0,589.0,-200.0,-200.0,-200.0,2004-03-24 23:00:00
25/03/2004,00:00:00,-200.0,997.0,81.0,,737.0,80.0,1168.0,89.0,1341.0,631.0,-200.0,-200.0,-200.0,2004-03-25 00:00:00
25/03/2004,01:00:00,1.0,970.0,52.0,,621.0,42.0,1400.0,58.0,1249.0,479.0,-200.0,-200.0,-200.0,2004-03-25 01:00:00
25/03/2004,02:00:00,-200.0,902.0,38.0,,568.0,38.0,1450.0,54.0,1253.0,479.0,-200.0,-200.0,-200.0,2004-03-25 02:00:00
25/03/2004,03:00:00,-200.0,921.0,35.0,,538.0,180.0,1564.0,109.0,1224.0,417.0,-200.0,-200.0,-200.0,2004-03-25 03:00:00
25/03/2004,04:00:00,-200.0,858.0,29.0,,490.0,18.0,1707.0,28.0,1212.0,378.0,-200.0,-200.0,-200.0,2004-03-25 04:00:00
25/03/2004,05:00:00,-200.0,878.0,21.0,,457.0,12.0,1935.0,20.0,1158.0,344.0,-200.0,-200.0,-200.0,2004-03-25 05:00:00
25/03/2004,06:00:00,-200.0,893.0,46.0,,540.0,43.0,1604.0,51.0,1268.0,413.0,-200.0,-200.0,-200.0,2004-03-25 06:00:00
25/03/2004,07:00:00,-200.0,1038.0,55.0,,697.0,84.0,1260.0,82.0,1383.0,605.0,-200.0,-200.0,-200.0,2004-03-25 07:00:00
25/03/2004,08:00:00,-200.0,1320.0,271.0,,1035.0,184.0,902.0,112.0,1721.0,991.0,-200.0,-200.0,-200.0,2004-03-25 08:00:00
25/03/2004,09:00:00,-200.0,1353.0,434.0,,1235.0,202.0,740.0,119.0,1937.0,1175.0,-200.0,-200.0,-200.0,2004-03-25 09:00:00
25/03/2004,10:00:00,-200.0,1133.0,300.0,,933.0,133.0,969.0,99.0,1552.0,923.0,-200.0,-200.0,-200.0,2004-03-25 10:00:00
25/03/2004,11:00:00,-200.0,1066.0,116.0,,849.0,130.0,1039.0,98.0,1468.0,829.0,-200.0,-200.0,-200.0,2004-03-25 11:00:00
25/03/2004,12:00:00,-200.0,1027.0,95.0,,809.0,106.0,1081.0,88.0,1442.0,733.0,-200.0,-200.0,-200.0,2004-03-25 12:00:00
25/03/2004,13:00:00,2.0,1106.0,211.0,,935.0,132.0,958.0,96.0,1570.0,819.0,-200.0,-200.0,-200.0,2004-03-25 13:00:00
25/03/2004,14:00:00,-200.0,1038.0,168.0,,907.0,106.0,976.0,81.0,1492.0,723.0,-200.0,-200.0,-200.0,2004-03-25 14:00:00
25/03/2004,15:00:00,-200.0,1084.0,154.0,,924.0,125.0,986.0,92.0,1501.0,786.0,-200.0,-200.0,-200.0,2004-03-25 15:00:00
25/03/2004,16:00:00,-200.0,1105.0,267.0,,982.0,138.0,939.0,105.0,1545.0,850.0,-200.0,-200.0,-200.0,2004-03-25 16:00:00
25/03/2004,17:00:00,2.0,1102.0,143.0,,957.0,120.0,968.0,88.0,1527.0,820.0,-200.0,-200.0,-200.0,2004-03-25 17:00:00
25/03/2004,18:00:00,-200.0,1240.0,374.0,,1137.0,158.0,836.0,103.0,1748.0,991.0,-200.0,-200.0,-200.0,2004-03-25 18:00:00
25/03/2004,19:00:00,-200.0,1443.0,797.0,,1418.0,253.0,666.0,141.0,2060.0,1454.0,-200.0,-200.0,-200.0,2004-03-25 19:00:00
25/03/2004,20:00:00,-200.0,1389.0,698.0,,1341.0,231.0,692.0,133.0,1982.0,1488.0,-200.0,-200.0,-200.0,2004-03-25 20:00:00
25/03/2004,21:00:00,-200.0,1183.0,234.0,,989.0,150.0,904.0,119.0,1539.0,1205.0,-200.0,-200.0,-200.0,2004-03-25 21:00:00
25/03/2004,22:00:00,-200.0,1014.0,104.0,,798.0,99.0,1083.0,106.0,1376.0,909.0,-200.0,-200.0,-200.0,2004-03-25 22:00:00
25/03/2004,23:00:00,-200.0,979.0,67.0,,736.0,75.0,1154.0,92.0,1324.0,769.0,-200.0,-200.0,-200.0,2004-03-25 23:00:00
26/03/2004,00:00:00,-200.0,1048.0,88.0,,787.0,93.0,1098.0,97.0,1373.0,835.0,-200.0,-200.0,-200.0,2004-03-26 00:00:00
26/03/2004,01:00:00,-200.0,1024.0,79.0,,753.0,79.0,1131.0,91.0,1357.0,793.0,-200.0,-200.0,-200.0,2004-03-26 01:00:00
26/03/2004,02:00:00,-200.0,974.0,61.0,,690.0,67.0,1208.0,83.0,1313.0,733.0,-200.0,-200.0,-200.0,2004-03-26 02:00:00
26/03/2004,03:00:00,-200.0,862.0,43.0,,561.0,180.0,1449.0,109.0,1219.0,502.0,-200.0,-200.0,-200.0,2004-03-26 03:00:00
26/03/2004,04:00:00,-200.0,925.0,40.0,,602.0,45.0,1398.0,59.0,1263.0,562.0,-200.0,-200.0,-200.0,2004-03-26 04:00:00
26/03/2004,05:00:00,-200.0,952.0,52.0,,654.0,72.0,1210.0,73.0,1312.0,832.0,-200.0,-200.0,-200.0,2004-03-26 05:00:00
26/03/2004,06:00:00,-200.0,1005.0,64.0,,713.0,103.0,1130.0,78.0,1363.0,924.0,-200.0,-200.0,-200.0,2004-03-26 06:00:00
26/03/2004,07:00:00,-200.0,1122.0,88.0,,842.0,132.0,1015.0,90.0,1438.0,974.0,-200.0,-200.0,-200.0,2004-03-26 07:00:00
26/03/2004,08:00:00,-200.0,1351.0,375.0,,1201.0,239.0,783.0,110.0,1828.0,1307.0,-200.0,-200.0,-200.0,2004-03-26 08:00:00
26/03/2004,09:00:00,-200.0,1408.0,592.0,,1278.0,275.0,682.0,114.0,1928.0,1481.0,-200.0,-200.0,-200.0,2004-03-26 09:00:00
26/03/2004,10:00:00,-200.0,1304.0,357.0,,1142.0,232.0,772.0,119.0,1747.0,1405.0,-200.0,-200.0,-200.0,2004-03-26 10:00:00
26/03/2004,11:00:00,-200.0,1207.0,296.0,,1098.0,180.0,826.0,121.0,1664.0,1195.0,-200.0,-200.0,-200.0,2004-03-26 11:00:00
26/03/2004,12:00:00,2.0,1099.0,181.0,,1014.0,112.0,948.0,97.0,1503.0,868.0,-200.0,-200.0,-200.0,2004-03-26 12:00:00
26/03/2004,13:00:00,-200.0,1106.0,211.0,,1068.0,116.0,915.0,99.0,1535.0,874.0,-200.0,-200.0,-200.0,2004-03-26 13:00:00
26/03/2004,14:00:00,-200.0,1009.0,199.0,,916.0,103.0,1015.0,85.0,1391.0,738.0,-200.0,-200.0,-200.0,2004-03-26 14:00:00
26/03/2004,15:00:00,-200.0,962.0,81.0,,776.0,89.0,1152.0,75.0,1279.0,550.0,-200.0,-200.0,-200.0,2004-03-26 15:00:00
26/03/2004,16:00:00,-200.0,1093.0,143.0,,933.0,112.0,976.0,87.0,1454.0,777.0,-200.0,-200.0,-200.0,2004-03-26 16:00:00
26/03/2004,17:00:00,-200.0,1180.0,247.0,,1023.0,127.0,886.0,102.0,1588.0,966.0,-200.0,-200.0,-200.0,2004-03-26 17:00:00
26/03/2004,18:00:00,-200.0,1168.0,239.0,,1037.0,125.0,868.0,105.0,1580.0,990.0,-200.0,-200.0,-200.0,2004-03-26 18:00:00
26/03/2004,19:00:00,-200.0,1168.0,267.0,,1063.0,120.0,876.0,98.0,1540.0,944.0,-200.0,-200.0,-200.0,2004-03-26 19:00:00
26/03/2004,20:00:00,-200.0,1140.0,261.0,,1000.0,120.0,916.0,93.0,1490.0,962.0,-200.0,-200.0,-200.0,2004-03-26 20:00:00
26/03/2004,21:00:00,-200.0,1001.0,97.0,,811.0,99.0,1097.0,91.0,1308.0,778.0,-200.0,-200.0,-200.0,2004-03-26 21:00:00
26/03/2004,22:00:00,-200.0,953.0,66.0,,743.0,79.0,1185.0,85.0,1252.0,690.0,-200.0,-200.0,-200.0,2004-03-26 22:00:00
26/03/2004,23:00:00,-200.0,972.0,60.0,,715.0,66.0,1237.0,74.0,1258.0,644.0,-200.0,-200.0,-200.0,2004-03-26 23:00:00
27/03/2004,00:00:00,-200.0,1021.0,77.0,,776.0,94.0,1144.0,87.0,1307.0,753.0,-200.0,-200.0,-200.0,2004-03-27 00:00:00
27/03/2004,01:00:00,1.0,940.0,57.0,,664.0,70.0,1290.0,79.0,1232.0,646.0,-200.0,-200.0,-200.0,2004-03-27 01:00:00
27/03/2004,02:00:00,-200.0,1046.0,65.0,,736.0,75.0,1142.0,78.0,1312.0,838.0,-200.0,-200.0,-200.0,2004-03-27 02:00:00
27/03/2004,03:00:00,-200.0,1026.0,59.0,,699.0,180.0,1191.0,109.0,1292.0,851.0,-200.0,-200.0,-200.0,2004-03-27 03:00:00
27/03/2004,04:00:00,-200.0,983.0,48.0,,698.0,57.0,1209.0,63.0,1296.0,801.0,-200.0,-200.0,-200.0,2004-03-27 04:00:00
27/03/2004,05:00:00,-200.0,915.0,27.0,,578.0,32.0,1417.0,48.0,1212.0,665.0,-200.0,-200.0,-200.0,2004-03-27 05:00:00
27/03/2004,06:00:00,-200.0,935.0,25.0,,615.0,54.0,1373.0,59.0,1250.0,717.0,-200.0,-200.0,-200.0,2004-03-27 06:00:00
27/03/2004,07:00:00,-200.0,976.0,42.0,,669.0,68.0,1270.0,65.0,1266.0,795.0,-200.0,-200.0,-200.0,2004-03-27 07:00:00
27/03/2004,08:00:00,-200.0,1124.0,78.0,,842.0,98.0,1050.0,71.0,1418.0,936.0,-200.0,-200.0,-200.0,2004-03-27 08:00:00
27/03/2004,09:00:00,-200.0,1163.0,128.0,,919.0,128.0,922.0,84.0,1530.0,1076.0,-200.0,-200.0,-200.0,2004-03-27 09:00:00
27/03/2004,10:00:00,-200.0,1167.0,184.0,,966.0,129.0,942.0,93.0,1520.0,1016.0,-200.0,-200.0,-200.0,2004-03-27 10:00:00
27/03/2004,11:00:00,-200.0,1121.0,156.0,,955.0,130.0,992.0,99.0,1451.0,834.0,-200.0,-200.0,-200.0,2004-03-27 11:00:00
27/03/2004,12:00:00,-200.0,1071.0,176.0,,940.0,111.0,994.0,93.0,1449.0,756.0,-200.0,-200.0,-200.0,2004-03-27 12:00:00
27/03/2004,13:00:00,-200.0,1065.0,232.0,,979.0,106.0,950.0,96.0,1467.0,766.0,-200.0,-200.0,-200.0,2004-03-27 13:00:00
27/03/2004,14:00:00,-200.0,1157.0,305.0,,1072.0,137.0,888.0,114.0,1596.0,905.0,-200.0,-200.0,-200.0,2004-03-27 14:00:00
27/03/2004,15:00:00,-200.0,1046.0,150.0,,883.0,113.0,1051.0,101.0,1357.0,765.0,-200.0,-200.0,-200.0,2004-03-27 15:00:00
27/03/2004,16:00:00,-200.0,1147.0,188.0,,1042.0,122.0,934.0,108.0,1538.0,830.0,-200.0,-200.0,-200.0,2004-03-27 16:00:00
27/03/2004,17:00:00,-200.0,1119.0,221.0,,1022.0,137.0,916.0,117.0,1508.0,853.0,-200.0,-200.0,-200.0,2004-03-27 17:00:00
27/03/2004,18:00:00,-200.0,1210.0,219.0,,1062.0,165.0,886.0,125.0,1586.0,981.0,-200.0,-200.0,-200.0,2004-03-27 18:00:00
27/03/2004,19:00:00,3.0,1306.0,306.0,,1079.0,196.0,827.0,133.0,1621.0,1286.0,-200.0,-200.0,-200.0,2004-03-27 19:00:00
27/03/2004,20:00:00,-200.0,1258.0,270.0,,1057.0,174.0,841.0,119.0,1633.0,1244.0,-200.0,-200.0,-200.0,2004-03-27 20:00:00
27/03/2004,21:00:00,-200.0,1148.0,231.0,,930.0,140.0,948.0,107.0,1475.0,1056.0,-200.0,-200.0,-200.0,2004-03-27 21:00:00
27/03/2004,22:00:00,-200.0,1108.0,125.0,,848.0,102.0,1023.0,96.0,1421.0,1003.0,-200.0,-200.0,-200.0,2004-03-27 22:00:00
27/03/2004,23:00:00,-200.0,1231.0,122.0,,924.0,130.0,906.0,105.0,1483.0,1245.0,-200.0,-200.0,-200.0,2004-03-27 23:00:00
28/03/2004,00:00:00,-200.0,1293.0,161.0,,937.0,121.0,930.0,102.0,1464.0,1200.0,-200.0,-200.0,-200.0,2004-03-28 00:00:00
28/03/2004,01:00:00,-200.0,1274.0,101.0,,912.0,111.0,939.0,97.0,1451.0,1188.0,-200.0,-200.0,-200.0,2004-03-28 01:00:00
28/03/2004,02:00:00,-200.0,1135.0,95.0,,827.0,87.0,1013.0,79.0,1395.0,1070.0,-200.0,-200.0,-200.0,2004-03-28 02:00:00
28/03/2004,03:00:00,-200.0,1151.0,129.0,,911.0,180.0,935.0,109.0,1501.0,1075.0,-200.0,-200.0,-200.0,2004-03-28 03:00:00
28/03/2004,04:00:00,-200.0,1010.0,96.0,,769.0,77.0,1110.0,69.0,1396.0,895.0,-200.0,-200.0,-200.0,2004-03-28 04:00:00
28/03/2004,05:00:00,-200.0,870.0,54.0,,626.0,39.0,1325.0,52.0,1284.0,755.0,-200.0,-200.0,-200.0,2004-03-28 05:00:00
28/03/2004,06:00:00,-200.0,983.0,63.0,,688.0,77.0,1251.0,62.0,1342.0,806.0,-200.0,-200.0,-200.0,2004-03-28 06:00:00
28/03/2004,07:00:00,-200.0,995.0,72.0,,691.0,91.0,1219.0,69.0,1321.0,836.0,-200.0,-200.0,-200.0,2004-03-28 07:00:00
28/03/2004,08:00:00,-200.0,1024.0,91.0,,747.0,105.0,1136.0,75.0,1382.0,897.0,-200.0,-200.0,-200.0,2004-03-28 08:00:00
28/03/2004,09:00:00,-200.0,1163.0,127.0,,880.0,133.0,959.0,83.0,1486.0,1073.0,-200.0,-200.0,-200.0,2004-03-28 09:00:00
28/03/2004,10:00:00,-200.0,1218.0,193.0,,938.0,128.0,918.0,94.0,1501.0,1088.0,-200.0,-200.0,-200.0,2004-03-28 10:00:00
28/03/2004,11:00:00,-200.0,1210.0,188.0,,958.0,126.0,933.0,96.0,1514.0,1036.0,-200.0,-200.0,-200.0,2004-03-28 11:00:00
28/03/2004,12:00:00,-200.0,1114.0,151.0,,887.0,92.0,1020.0,86.0,1438.0,768.0,-200.0,-200.0,-200.0,2004-03-28 12:00:00
28/03/2004,13:00:00,-200.0,995.0,103.0,,796.0,66.0,1159.0,72.0,1287.0,587.0,-200.0,-200.0,-200.0,2004-03-28 13:00:00
28/03/2004,14:00:00,1.0,927.0,55.0,,700.0,50.0,1285.0,53.0,1189.0,452.0,-200.0,-200.0,-200.0,2004-03-28 14:00:00
28/03/2004,15:00:00,-200.0,1002.0,104.0,,754.0,70.0,1189.0,65.0,1260.0,470.0,-200.0,-200.0,-200.0,2004-03-28 15:00:00
28/03/2004,16:00:00,-200.0,987.0,116.0,,727.0,73.0,1213.0,70.0,1244.0,502.0,-200.0,-200.0,-200.0,2004-03-28 16:00:00
28/03/2004,17:00:00,-200.0,993.0,93.0,,714.0,77.0,1217.0,75.0,1238.0,516.0,-200.0,-200.0,-200.0,2004-03-28 17:00:00
28/03/2004,18:00:00,-200.0,1012.0,93.0,,746.0,86.0,1174.0,86.0,1301.0,555.0,-200.0,-200.0,-200.0,2004-03-28 18:00:00
28/03/2004,19:00:00,-200.0,1114.0,155.0,,823.0,93.0,1068.0,94.0,1357.0,671.0,-200.0,-200.0,-200.0,2004-03-28 19:00:00
28/03/2004,20:00:00,-200.0,1093.0,115.0,,789.0,105.0,1102.0,103.0,1329.0,788.0,-200.0,-200.0,-200.0,2004-03-28 20:00:00
28/03/2004,21:00:00,-200.0,968.0,75.0,,669.0,67.0,1261.0,81.0,1246.0,538.0,-200.0,-200.0,-200.0,2004-03-28 21:00:00
28/03/2004,22:00:00,-200.0,960.0,65.0,,666.0,63.0,1266.0,80.0,1224.0,544.0,-200.0,-200.0,-200.0,2004-03-28 22:00:00
28/03/2004,23:00:00,-200.0,942.0,57.0,,648.0,63.0,1300.0,77.0,1204.0,500.0,-200.0,-200.0,-200.0,2004-03-28 23:00:00
29/03/2004,00:00:00,-200.0,888.0,40.0,,598.0,46.0,1396.0,58.0,1156.0,417.0,-200.0,-200.0,-200.0,2004-03-29 00:00:00
29/03/2004,01:00:00,-200.0,818.0,27.0,,524.0,21.0,1588.0,31.0,1071.0,341.0,-200.0,-200.0,-200.0,2004-03-29 01:00:00
29/03/2004,02:00:00,-200.0,840.0,23.0,,509.0,22.0,1643.0,38.0,1076.0,352.0,-200.0,-200.0,-200.0,2004-03-29 02:00:00
29/03/2004,03:00:00,-200.0,894.0,28.0,,524.0,180.0,1557.0,109.0,1095.0,397.0,-200.0,-200.0,-200.0,2004-03-29 03:00:00
29/03/2004,04:00:00,-200.0,864.0,21.0,,516.0,39.0,1496.0,59.0,1153.0,502.0,-200.0,-200.0,-200.0,2004-03-29 04:00:00
29/03/2004,05:00:00,-200.0,898.0,33.0,,559.0,55.0,1441.0,70.0,1180.0,648.0,-200.0,-200.0,-200.0,2004-03-29 05:00:00
29/03/2004,06:00:00,-200.0,946.0,40.0,,643.0,76.0,1309.0,75.0,1232.0,760.0,-200.0,-200.0,-200.0,2004-03-29 06:00:00
29/03/2004,07:00:00,-200.0,1309.0,279.0,,1125.0,181.0,844.0,103.0,1687.0,1183.0,-200.0,-200.0,-200.0,2004-03-29 07:00:00
29/03/2004,08:00:00,-200.0,1326.0,743.0,,1289.0,259.0,714.0,134.0,1806.0,1431.0,-200.0,-200.0,-200.0,2004-03-29 08:00:00
29/03/2004,09:00:00,-200.0,966.0,147.0,,786.0,118.0,1111.0,98.0,1258.0,705.0,-200.0,-200.0,-200.0,2004-03-29 09:00:00
29/03/2004,10:00:00,-200.0,975.0,97.0,,793.0,119.0,1133.0,97.0,1254.0,637.0,-200.0,-200.0,-200.0,2004-03-29 10:00:00
29/03/2004,11:00:00,-200.0,988.0,118.0,,803.0,123.0,1105.0,98.0,1293.0,658.0,-200.0,-200.0,-200.0,2004-03-29 11:00:00
29/03/2004,12:00:00,-200.0,971.0,91.0,,786.0,92.0,1129.0,78.0,1272.0,546.0,-200.0,-200.0,-200.0,2004-03-29 12:00:00
29/03/2004,13:00:00,-200.0,1010.0,146.0,,833.0,91.0,1070.0,83.0,1332.0,561.0,-200.0,-200.0,-200.0,2004-03-29 13:00:00
29/03/2004,14:00:00,-200.0,984.0,139.0,,790.0,103.0,1131.0,92.0,1268.0,532.0,-200.0,-200.0,-200.0,2004-03-29 14:00:00
29/03/2004,15:00:00,-200.0,962.0,155.0,,776.0,102.0,1131.0,81.0,1247.0,535.0,-200.0,-200.0,-200.0,2004-03-29 15:00:00
29/03/2004,16:00:00,-200.0,1012.0,128.0,,801.0,94.0,1098.0,90.0,1289.0,525.0,-200.0,-200.0,-200.0,2004-03-29 16:00:00
29/03/2004,17:00:00,-200.0,1058.0,166.0,,896.0,98.0,996.0,95.0,1358.0,603.0,-200.0,-200.0,-200.0,2004-03-29 17:00:00
29/03/2004,18:00:00,-200.0,1173.0,299.0,,985.0,126.0,905.0,114.0,1477.0,802.0,-200.0,-200.0,-200.0,2004-03-29 18:00:00
29/03/2004,19:00:00,-200.0,1127.0,163.0,,907.0,108.0,957.0,106.0,1404.0,796.0,-200.0,-200.0,-200.0,2004-03-29 19:00:00
29/03/2004,20:00:00,-200.0,1020.0,154.0,,797.0,95.0,1066.0,99.0,1302.0,689.0,-200.0,-200.0,-200.0,2004-03-29 20:00:00
29/03/2004,21:00:00,-200.0,949.0,80.0,,700.0,78.0,1221.0,90.0,1178.0,553.0,-200.0,-200.0,-200.0,2004-03-29 21:00:00
29/03/2004,22:00:00,-200.0,930.0,58.0,,710.0,61.0,1278.0,82.0,1137.0,509.0,-200.0,-200.0,-200.0,2004-03-29 22:00:00
29/03/2004,23:00:00,1.0,900.0,55.0,,643.0,55.0,1339.0,74.0,1089.0,455.0,-200.0,-200.0,-200.0,2004-03-29 23:00:00
30/03/2004,00:00:00,1.0,899.0,33.0,,630.0,57.0,1418.0,76.0,1050.0,425.0,-200.0,-200.0,-200.0,2004-03-30 00:00:00
30/03/2004,01:00:00,-200.0,866.0,33.0,,569.0,41.0,1468.0,66.0,1055.0,436.0,-200.0,-200.0,-200.0,2004-03-30 01:00:00
30/03/2004,02:00:00,-200.0,900.0,32.0,,563.0,46.0,1402.0,73.0,1130.0,618.0,-200.0,-200.0,-200.0,2004-03-30 02:00:00
30/03/2004,03:00:00,-200.0,949.0,25.0,,540.0,180.0,1457.0,109.0,1104.0,747.0,-200.0,-200.0,-200.0,2004-03-30 03:00:00
30/03/2004,04:00:00,-200.0,897.0,29.0,,529.0,41.0,1462.0,69.0,1101.0,693.0,-200.0,-200.0,-200.0,2004-03-30 04:00:00
30/03/2004,05:00:00,-200.0,956.0,26.0,,605.0,52.0,1341.0,71.0,1117.0,691.0,-200.0,-200.0,-200.0,2004-03-30 05:00:00
30/03/2004,06:00:00,-200.0,1054.0,86.0,,779.0,111.0,1080.0,98.0,1266.0,1013.0,-200.0,-200.0,-200.0,2004-03-30 06:00:00
30/03/2004,07:00:00,-200.0,1343.0,294.0,,1096.0,191.0,839.0,115.0,1587.0,1311.0,-200.0,-200.0,-200.0,2004-03-30 07:00:00
30/03/2004,08:00:00,4.0,1584.0,664.0,,1399.0,244.0,642.0,130.0,1947.0,1675.0,-200.0,-200.0,-200.0,2004-03-30 08:00:00
30/03/2004,09:00:00,-200.0,1556.0,695.0,,1337.0,283.0,674.0,150.0,1852.0,1689.0,-200.0,-200.0,-200.0,2004-03-30 09:00:00
30/03/2004,10:00:00,-200.0,1565.0,735.0,,1324.0,320.0,695.0,159.0,1872.0,1688.0,-200.0,-200.0,-200.0,2004-03-30 10:00:00
30/03/2004,11:00:00,-200.0,1429.0,649.0,,1251.0,249.0,734.0,146.0,1754.0,1548.0,-200.0,-200.0,-200.0,2004-03-30 11:00:00
30/03/2004,12:00:00,-200.0,1419.0,586.0,,1267.0,219.0,742.0,138.0,1763.0,1490.0,-200.0,-200.0,-200.0,2004-03-30 12:00:00
30/03/2004,13:00:00,-200.0,1373.0,546.0,,1213.0,200.0,791.0,128.0,1711.0,1354.0,-200.0,-200.0,-200.0,2004-03-30 13:00:00
30/03/2004,14:00:00,-200.0,1185.0,245.0,,992.0,138.0,942.0,97.0,1448.0,1014.0,-200.0,-200.0,-200.0,2004-03-30 14:00:00
30/03/2004,15:00:00,-200.0,1122.0,178.0,,897.0,118.0,991.0,91.0,1372.0,831.0,-200.0,-200.0,-200.0,2004-03-30 15:00:00
30/03/2004,16:00:00,-200.0,1085.0,130.0,,820.0,99.0,1060.0,81.0,1325.0,699.0,-200.0,-200.0,-200.0,2004-03-30 16:00:00
30/03/2004,17:00:00,-200.0,1249.0,151.0,,968.0,112.0,874.0,99.0,1527.0,926.0,-200.0,-200.0,-200.0,2004-03-30 17:00:00
30/03/2004,18:00:00,-200.0,1236.0,272.0,,962.0,117.0,853.0,101.0,1532.0,928.0,-200.0,-200.0,-200.0,2004-03-30 18:00:00
30/03/2004,19:00:00,-200.0,1334.0,301.0,,1047.0,129.0,815.0,106.0,1638.0,1038.0,-200.0,-200.0,-200.0,2004-03-30 19:00:00
30/03/2004,20:00:00,-200.0,1264.0,237.0,,928.0,132.0,884.0,102.0,1534.0,1035.0,-200.0,-200.0,-200.0,2004-03-30 20:00:00
30/03/2004,21:00:00,-200.0,1073.0,95.0,,746.0,73.0,1072.0,84.0,1360.0,789.0,-200.0,-200.0,-200.0,2004-03-30 21:00:00
30/03/2004,22:00:00,-200.0,1053.0,68.0,,701.0,68.0,1147.0,81.0,1323.0,692.0,-200.0,-200.0,-200.0,2004-03-30 22:00:00
30/03/2004,23:00:00,-200.0,1098.0,101.0,,747.0,80.0,1094.0,91.0,1360.0,764.0,-200.0,-200.0,-200.0,2004-03-30 23:00:00
31/03/2004,00:00:00,-200.0,1029.0,81.0,,702.0,68.0,1180.0,82.0,1287.0,639.0,-200.0,-200.0,-200.0,2004-03-31 00:00:00
31/03/2004,01:00:00,1.0,973.0,50.0,,631.0,44.0,1287.0,64.0,1240.0,541.0,-200.0,-200.0,-200.0,2004-03-31 01:00:00
31/03/2004,02:00:00,-200.0,972.0,66.0,,639.0,47.0,1222.0,70.0,1256.0,678.0,-200.0,-200.0,-200.0,2004-03-31 02:00:00
31/03/2004,03:00:00,-200.0,832.0,22.0,,496.0,180.0,1613.0,109.0,1066.0,381.0,-200.0,-200.0,-200.0,2004-03-31 03:00:00
31/03/2004,04:00:00,-200.0,851.0,18.0,,477.0,15.0,1699.0,26.0,1064.0,343.0,-200.0,-200.0,-200.0,2004-03-31 04:00:00
31/03/2004,05:00:00,-200.0,909.0,31.0,,545.0,44.0,1473.0,58.0,1131.0,436.0,-200.0,-200.0,-200.0,2004-03-31 05:00:00
31/03/2004,06:00:00,1.0,1038.0,57.0,,684.0,85.0,1220.0,93.0,1279.0,688.0,-200.0,-200.0,-200.0,2004-03-31 06:00:00
31/03/2004,07:00:00,-200.0,1636.0,342.0,,1168.0,207.0,721.0,110.0,1926.0,1438.0,-200.0,-200.0,-200.0,2004-03-31 07:00:00
31/03/2004,08:00:00,-200.0,1580.0,644.0,,1295.0,230.0,639.0,115.0,1957.0,1489.0,-200.0,-200.0,-200.0,2004-03-31 08:00:00
31/03/2004,09:00:00,-200.0,1262.0,216.0,,924.0,181.0,872.0,125.0,1576.0,1093.0,-200.0,-200.0,-200.0,2004-03-31 09:00:00
31/03/2004,10:00:00,-200.0,1197.0,117.0,,837.0,144.0,957.0,118.0,1498.0,965.0,-200.0,-200.0,-200.0,2004-03-31 10:00:00
31/03/2004,11:00:00,-200.0,1277.0,156.0,,886.0,140.0,902.0,109.0,1579.0,1004.0,-200.0,-200.0,-200.0,2004-03-31 11:00:00
31/03/2004,12:00:00,-200.0,1430.0,332.0,,1025.0,204.0,779.0,123.0,1772.0,1166.0,-200.0,-200.0,-200.0,2004-03-31 12:00:00
31/03/2004,13:00:00,-200.0,1242.0,232.0,,944.0,149.0,846.0,114.0,1638.0,991.0,-200.0,-200.0,-200.0,2004-03-31 13:00:00
31/03/2004,14:00:00,-200.0,1349.0,295.0,,1023.0,171.0,804.0,114.0,1748.0,1054.0,-200.0,-200.0,-200.0,2004-03-31 14:00:00
31/03/2004,15:00:00,-200.0,1390.0,386.0,,1100.0,195.0,755.0,119.0,1799.0,1192.0,-200.0,-200.0,-200.0,2004-03-31 15:00:00
31/03/2004,16:00:00,-200.0,1224.0,278.0,,980.0,152.0,850.0,111.0,1637.0,1055.0,-200.0,-200.0,-200.0,2004-03-31 16:00:00
31/03/2004,17:00:00,-200.0,1253.0,263.0,,1026.0,128.0,810.0,103.0,1681.0,1048.0,-200.0,-200.0,-200.0,2004-03-31 17:00:00
31/03/2004,18:00:00,-200.0,1312.0,322.0,,1041.0,121.0,821.0,103.0,1712.0,1073.0,-200.0,-200.0,-200.0,2004-03-31 18:00:00
31/03/2004,19:00:00,-200.0,1254.0,226.0,,1033.0,142.0,819.0,107.0,1669.0,1068.0,-200.0,-200.0,-200.0,2004-03-31 19:00:00
31/03/2004,20:00:00,-200.0,1198.0,221.0,,953.0,131.0,882.0,105.0,1588.0,1019.0,-200.0,-200.0,-200.0,2004-03-31 20:00:00
31/03/2004,21:00:00,-200.0,1060.0,109.0,,787.0,81.0,1044.0,91.0,1418.0,833.0,-200.0,-200.0,-200.0,2004-03-31 21:00:00
31/03/2004,22:00:00,-200.0,1050.0,105.0,,769.0,60.0,1078.0,79.0,1409.0,759.0,-200.0,-200.0,-200.0,2004-03-31 22:00:00
31/03/2004,23:00:00,-200.0,1029.0,84.0,,754.0,57.0,1098.0,79.0,1395.0,749.0,-200.0,-200.0,-200.0,2004-03-31 23:00:00
01/04/2004,00:00:00,-200.0,1143.0,106.0,,825.0,96.0,986.0,86.0,1477.0,978.0,-200.0,-200.0,-200.0,2004-04-01 00:00:00
01/04/2004,01:00:00,-200.0,1044.0,100.0,,770.0,85.0,1031.0,70.0,1425.0,944.0,-200.0,-200.0,-200.0,2004-04-01 01:00:00
01/04/2004,02:00:00,-200.0,1034.0,71.0,,716.0,50.0,1085.0,55.0,1405.0,891.0,-200.0,-200.0,-200.0,2004-04-01 02:00:00
01/04/2004,03:00:00,-200.0,956.0,72.0,,713.0,180.0,1099.0,109.0,1422.0,849.0,-200.0,-200.0,-200.0,2004-04-01 03:00:00
01/04/2004,04:00:00,-200.0,909.0,44.0,,615.0,57.0,1237.0,49.0,1322.0,790.0,-200.0,-200.0,-200.0,2004-04-01 04:00:00
01/04/2004,05:00:00,-200.0,996.0,45.0,,648.0,64.0,1176.0,50.0,1340.0,852.0,-200.0,-200.0,-200.0,2004-04-01 05:00:00
01/04/2004,06:00:00,-200.0,1154.0,134.0,,876.0,153.0,1002.0,67.0,1561.0,987.0,-200.0,-200.0,-200.0,2004-04-01 06:00:00
01/04/2004,07:00:00,-200.0,1510.0,505.0,,1291.0,342.0,675.0,94.0,1949.0,1435.0,-200.0,-200.0,-200.0,2004-04-01 07:00:00
01/04/2004,08:00:00,-200.0,1722.0,1042.0,,1595.0,378.0,539.0,119.0,2439.0,1798.0,-200.0,-200.0,-200.0,2004-04-01 08:00:00
01/04/2004,09:00:00,-200.0,1512.0,737.0,,1323.0,304.0,631.0,139.0,2001.0,1677.0,-200.0,-200.0,-200.0,2004-04-01 09:00:00
01/04/2004,10:00:00,-200.0,1258.0,375.0,,1040.0,192.0,800.0,113.0,1701.0,1282.0,-200.0,-200.0,-200.0,2004-04-01 10:00:00
01/04/2004,11:00:00,-200.0,1094.0,124.0,,850.0,130.0,970.0,88.0,1489.0,871.0,-200.0,-200.0,-200.0,2004-04-01 11:00:00
01/04/2004,12:00:00,-200.0,1129.0,137.0,,875.0,106.0,974.0,73.0,1524.0,759.0,-200.0,-200.0,-200.0,2004-04-01 12:00:00
01/04/2004,13:00:00,-200.0,1125.0,179.0,,924.0,102.0,937.0,73.0,1542.0,790.0,-200.0,-200.0,-200.0,2004-04-01 13:00:00
01/04/2004,14:00:00,-200.0,1063.0,222.0,,909.0,99.0,806.0,72.0,1463.0,963.0,-200.0,-200.0,-200.0,2004-04-01 14:00:00
01/04/2004,15:00:00,-200.0,1063.0,197.0,,909.0,108.0,806.0,81.0,1463.0,963.0,-200.0,-200.0,-200.0,2004-04-01 15:00:00
01/04/2004,16:00:00,-200.0,1063.0,319.0,,909.0,131.0,806.0,93.0,1463.0,963.0,-200.0,-200.0,-200.0,2004-04-01 16:00:00
01/04/2004,17:00:00,-200.0,1308.0,388.0,,1193.0,163.0,793.0,106.0,1193.0,1187.0,-200.0,-200.0,-200.0,2004-04-01 17:00:00
01/04/2004,18:00:00,-200.0,1529.0,589.0,,1331.0,211.0,700.0,132.0,2028.0,1399.0,-200.0,-200.0,-200.0,2004-04-01 18:00:00
01/04/2004,19:00:00,-200.0,1592.0,840.0,,1429.0,267.0,624.0,164.0,2089.0,1644.0,-200.0,-200.0,-200.0,2004-04-01 19:00:00
01/04/2004,20:00:00,-200.0,1536.0,655.0,,1302.0,269.0,666.0,161.0,1922.0,1599.0,-200.0,-200.0,-200.0,2004-04-01 20:00:00
01/04/2004,21:00:00,-200.0,1192.0,254.0,,1007.0,154.0,827.0,124.0,1604.0,1223.0,-200.0,-200.0,-200.0,2004-04-01 21:00:00
01/04/2004,22:00:00,2.0,1186.0,188.0,,976.0,127.0,844.0,113.0,1570.0,1200.0,-200.0,-200.0,-200.0,2004-04-01 22:00:00
01/04/2004,23:00:00,2.0,1203.0,120.0,,920.0,122.0,898.0,103.0,1529.0,1118.0,-200.0,-200.0,-200.0,2004-04-01 23:00:00
02/04/2004,00:00:00,2.0,1139.0,157.0,,899.0,126.0,921.0,104.0,1514.0,1067.0,-200.0,-200.0,-200.0,2004-04-02 00:00:00
02/04/2004,01:00:00,-200.0,1072.0,88.0,,795.0,84.0,986.0,93.0,1442.0,1048.0,-200.0,-200.0,-200.0,2004-04-02 01:00:00
02/04/2004,02:00:00,1.0,954.0,68.0,,667.0,58.0,1180.0,60.0,1350.0,718.0,-200.0,-200.0,-200.0,2004-04-02 02:00:00
02/04/2004,03:00:00,-200.0,951.0,57.0,,673.0,180.0,1137.0,109.0,1381.0,797.0,-200.0,-200.0,-200.0,2004-04-02 03:00:00
02/04/2004,04:00:00,-200.0,926.0,36.0,,638.0,37.0,1195.0,52.0,1342.0,749.0,-200.0,-200.0,-200.0,2004-04-02 04:00:00
02/04/2004,05:00:00,-200.0,968.0,51.0,,628.0,56.0,1197.0,66.0,1372.0,737.0,-200.0,-200.0,-200.0,2004-04-02 05:00:00
02/04/2004,06:00:00,-200.0,1067.0,93.0,,727.0,91.0,1055.0,82.0,1448.0,903.0,-200.0,-200.0,-200.0,2004-04-02 06:00:00
02/04/2004,07:00:00,-200.0,1386.0,284.0,,1083.0,159.0,798.0,109.0,1833.0,1159.0,-200.0,-200.0,-200.0,2004-04-02 07:00:00
02/04/2004,08:00:00,-200.0,1474.0,486.0,,1306.0,190.0,634.0,114.0,2060.0,1365.0,-200.0,-200.0,-200.0,2004-04-02 08:00:00
02/04/2004,09:00:00,5.0,1569.0,798.0,,1316.0,249.0,634.0,139.0,2054.0,1510.0,-200.0,-200.0,-200.0,2004-04-02 09:00:00
02/04/2004,10:00:00,-200.0,1375.0,524.0,,1177.0,196.0,706.0,127.0,1898.0,1386.0,-200.0,-200.0,-200.0,2004-04-02 10:00:00
02/04/2004,11:00:00,-200.0,1328.0,468.0,,1123.0,180.0,738.0,127.0,1821.0,1368.0,-200.0,-200.0,-200.0,2004-04-02 11:00:00
02/04/2004,12:00:00,-200.0,1341.0,454.0,,1176.0,167.0,748.0,135.0,1825.0,1347.0,-200.0,-200.0,-200.0,2004-04-02 12:00:00
02/04/2004,13:00:00,3.0,1297.0,461.0,,1183.0,159.0,765.0,130.0,1773.0,1242.0,-200.0,-200.0,-200.0,2004-04-02 13:00:00
02/04/2004,14:00:00,-200.0,1303.0,391.0,,1139.0,152.0,790.0,126.0,1761.0,1138.0,-200.0,-200.0,-200.0,2004-04-02 14:00:00
02/04/2004,15:00:00,-200.0,1281.0,337.0,,1116.0,149.0,809.0,121.0,1703.0,1080.0,-200.0,-200.0,-200.0,2004-04-02 15:00:00
02/04/2004,16:00:00,-200.0,1248.0,297.0,,1103.0,143.0,872.0,122.0,1632.0,1002.0,-200.0,-200.0,-200.0,2004-04-02 16:00:00
02/04/2004,17:00:00,-200.0,1382.0,588.0,,1288.0,185.0,778.0,138.0,1799.0,1212.0,-200.0,-200.0,-200.0,2004-04-02 17:00:00
02/04/2004,18:00:00,-200.0,1491.0,721.0,,1385.0,223.0,685.0,165.0,1915.0,1486.0,-200.0,-200.0,-200.0,2004-04-02 18:00:00
02/04/2004,19:00:00,-200.0,1620.0,710.0,,1407.0,215.0,641.0,154.0,2052.0,1567.0,-200.0,-200.0,-200.0,2004-04-02 19:00:00
02/04/2004,20:00:00,-200.0,1693.0,787.0,,1439.0,271.0,618.0,168.0,2083.0,1723.0,-200.0,-200.0,-200.0,2004-04-02 20:00:00
02/04/2004,21:00:00,3.0,1374.0,415.0,,1121.0,180.0,771.0,146.0,1685.0,1399.0,-200.0,-200.0,-200.0,2004-04-02 21:00:00
02/04/2004,22:00:00,-200.0,1287.0,245.0,,982.0,115.0,841.0,124.0,1582.0,1291.0,-200.0,-200.0,-200.0,2004-04-02 22:00:00
02/04/2004,23:00:00,-200.0,1408.0,294.0,,1052.0,149.0,761.0,124.0,1684.0,1443.0,-200.0,-200.0,-200.0,2004-04-02 23:00:00
03/04/2004,00:00:00,-200.0,1254.0,139.0,,941.0,98.0,828.0,106.0,1566.0,1270.0,-200.0,-200.0,-200.0,2004-04-03 00:00:00
03/04/2004,01:00:00,-200.0,1141.0,98.0,,827.0,73.0,936.0,88.0,1488.0,1110.0,-200.0,-200.0,-200.0,2004-04-03 01:00:00
03/04/2004,02:00:00,-200.0,1141.0,88.0,,777.0,69.0,986.0,83.0,1455.0,1060.0,-200.0,-200.0,-200.0,2004-04-03 02:00:00
03/04/2004,03:00:00,-200.0,1042.0,66.0,,697.0,180.0,1056.0,109.0,1410.0,965.0,-200.0,-200.0,-200.0,2004-04-03 03:00:00
03/04/2004,04:00:00,-200.0,986.0,57.0,,651.0,60.0,1145.0,74.0,1380.0,891.0,-200.0,-200.0,-200.0,2004-04-03 04:00:00
03/04/2004,05:00:00,-200.0,1005.0,57.0,,673.0,56.0,1103.0,64.0,1387.0,905.0,-200.0,-200.0,-200.0,2004-04-03 05:00:00
03/04/2004,06:00:00,-200.0,1041.0,60.0,,683.0,73.0,1112.0,69.0,1398.0,899.0,-200.0,-200.0,-200.0,2004-04-03 06:00:00
03/04/2004,07:00:00,2.0,1272.0,200.0,,959.0,159.0,846.0,91.0,1660.0,1136.0,-200.0,-200.0,-200.0,2004-04-03 07:00:00
03/04/2004,08:00:00,3.0,1436.0,451.0,,1154.0,203.0,704.0,96.0,1872.0,1391.0,-200.0,-200.0,-200.0,2004-04-03 08:00:00
03/04/2004,09:00:00,-200.0,1472.0,422.0,,1126.0,211.0,720.0,106.0,1816.0,1460.0,-200.0,-200.0,-200.0,2004-04-03 09:00:00
03/04/2004,10:00:00,-200.0,1418.0,150.0,,1023.0,180.0,785.0,109.0,1720.0,1410.0,-200.0,-200.0,-200.0,2004-04-03 10:00:00
03/04/2004,11:00:00,-200.0,1410.0,150.0,,1030.0,180.0,781.0,109.0,1743.0,1372.0,-200.0,-200.0,-200.0,2004-04-03 11:00:00
03/04/2004,12:00:00,-200.0,1438.0,150.0,,1096.0,180.0,781.0,109.0,1779.0,1266.0,-200.0,-200.0,-200.0,2004-04-03 12:00:00
03/04/2004,13:00:00,-200.0,1278.0,150.0,,1000.0,180.0,866.0,109.0,1621.0,1014.0,-200.0,-200.0,-200.0,2004-04-03 13:00:00
03/04/2004,14:00:00,-200.0,1257.0,150.0,,1006.0,180.0,915.0,109.0,1573.0,870.0,-200.0,-200.0,-200.0,2004-04-03 14:00:00
03/04/2004,15:00:00,-200.0,1331.0,150.0,,1046.0,180.0,882.0,109.0,1635.0,905.0,-200.0,-200.0,-200.0,2004-04-03 15:00:00
03/04/2004,16:00:00,-200.0,1361.0,150.0,,1102.0,180.0,834.0,109.0,1704.0,991.0,-200.0,-200.0,-200.0,2004-04-03 16:00:00
03/04/2004,17:00:00,-200.0,1398.0,150.0,,1156.0,180.0,812.0,109.0,1722.0,1076.0,-200.0,-200.0,-200.0,2004-04-03 17:00:00
03/04/2004,18:00:00,-200.0,1483.0,150.0,,1213.0,180.0,764.0,109.0,1798.0,1249.0,-200.0,-200.0,-200.0,2004-04-03 18:00:00
03/04/2004,19:00:00,-200.0,1697.0,150.0,,1471.0,180.0,625.0,109.0,2153.0,1548.0,-200.0,-200.0,-200.0,2004-04-03 19:00:00
03/04/2004,20:00:00,-200.0,1459.0,150.0,,1124.0,180.0,736.0,109.0,1823.0,1300.0,-200.0,-200.0,-200.0,2004-04-03 20:00:00
03/04/2004,21:00:00,-200.0,1268.0,150.0,,918.0,180.0,873.0,109.0,1602.0,1029.0,-200.0,-200.0,-200.0,2004-04-03 21:00:00
03/04/2004,22:00:00,-200.0,1469.0,150.0,,1128.0,180.0,762.0,109.0,1870.0,1207.0,-200.0,-200.0,-200.0,2004-04-03 22:00:00
03/04/2004,23:00:00,-200.0,1316.0,150.0,,952.0,180.0,847.0,109.0,1644.0,1047.0,-200.0,-200.0,-200.0,2004-04-03 23:00:00
04/04/2004,00:00:00,-200.0,1224.0,150.0,,892.0,180.0,884.0,109.0,1580.0,923.0,-200.0,-200.0,-200.0,2004-04-04 00:00:00
04/04/2004,01:00:00,-200.0,1215.0,150.0,,843.0,180.0,929.0,109.0,1551.0,862.0,-200.0,-200.0,-200.0,2004-04-04 01:00:00
04/04/2004,02:00:00,-200.0,1115.0,150.0,,782.0,180.0,980.0,109.0,1500.0,752.0,-200.0,-200.0,-200.0,2004-04-04 02:00:00
04/04/2004,03:00:00,-200.0,1124.0,150.0,,793.0,180.0,965.0,109.0,1521.0,791.0,-200.0,-200.0,-200.0,2004-04-04 03:00:00
04/04/2004,04:00:00,-200.0,1028.0,150.0,,682.0,180.0,1090.0,109.0,1448.0,697.0,-200.0,-200.0,-200.0,2004-04-04 04:00:00
04/04/2004,05:00:00,-200.0,1010.0,150.0,,650.0,180.0,1171.0,109.0,1434.0,664.0,-200.0,-200.0,-200.0,2004-04-04 05:00:00
04/04/2004,06:00:00,-200.0,1074.0,150.0,,731.0,180.0,1020.0,109.0,1488.0,891.0,-200.0,-200.0,-200.0,2004-04-04 06:00:00
04/04/2004,07:00:00,-200.0,1034.0,150.0,,684.0,180.0,1110.0,109.0,1423.0,813.0,-200.0,-200.0,-200.0,2004-04-04 07:00:00
04/04/2004,08:00:00,-200.0,1130.0,150.0,,720.0,180.0,1063.0,109.0,1461.0,828.0,-200.0,-200.0,-200.0,2004-04-04 08:00:00
04/04/2004,09:00:00,-200.0,1275.0,150.0,,900.0,180.0,868.0,109.0,1634.0,1057.0,-200.0,-200.0,-200.0,2004-04-04 09:00:00
04/04/2004,10:00:00,-200.0,1324.0,150.0,,939.0,180.0,846.0,109.0,1658.0,1011.0,-200.0,-200.0,-200.0,2004-04-04 10:00:00
04/04/2004,11:00:00,-200.0,1268.0,150.0,,902.0,180.0,906.0,109.0,1589.0,932.0,-200.0,-200.0,-200.0,2004-04-04 11:00:00
04/04/2004,12:00:00,-200.0,1272.0,150.0,,924.0,180.0,895.0,109.0,1603.0,881.0,-200.0,-200.0,-200.0,2004-04-04 12:00:00
04/04/2004,13:00:00,-200.0,1160.0,150.0,,860.0,180.0,969.0,109.0,1531.0,646.0,-200.0,-200.0,-200.0,2004-04-04 13:00:00
04/04/2004,14:00:00,-200.0,1136.0,150.0,,792.0,180.0,1057.0,109.0,1476.0,536.0,-200.0,-200.0,-200.0,2004-04-04 14:00:00
04/04/2004,15:00:00,-200.0,1296.0,150.0,,977.0,180.0,863.0,109.0,1642.0,746.0,-200.0,-200.0,-200.0,2004-04-04 15:00:00
04/04/2004,16:00:00,-200.0,1345.0,150.0,,996.0,180.0,841.0,109.0,1678.0,833.0,-200.0,-200.0,-200.0,2004-04-04 16:00:00
04/04/2004,17:00:00,-200.0,1296.0,150.0,,983.0,180.0,845.0,109.0,1626.0,802.0,-200.0,-200.0,-200.0,2004-04-04 17:00:00
04/04/2004,18:00:00,-200.0,1258.0,150.0,,977.0,180.0,838.0,109.0,1636.0,838.0,-200.0,-200.0,-200.0,2004-04-04 18:00:00
04/04/2004,19:00:00,-200.0,1420.0,150.0,,1085.0,180.0,755.0,109.0,1756.0,1051.0,-200.0,-200.0,-200.0,2004-04-04 19:00:00
04/04/2004,20:00:00,-200.0,1366.0,150.0,,997.0,180.0,830.0,109.0,1673.0,1041.0,-200.0,-200.0,-200.0,2004-04-04 20:00:00
04/04/2004,21:00:00,-200.0,1113.0,150.0,,772.0,180.0,989.0,109.0,1493.0,646.0,-200.0,-200.0,-200.0,2004-04-04 21:00:00
04/04/2004,22:00:00,-200.0,1196.0,150.0,,853.0,180.0,909.0,109.0,1556.0,769.0,-200.0,-200.0,-200.0,2004-04-04 22:00:00
04/04/2004,23:00:00,-200.0,1188.0,150.0,,829.0,180.0,930.0,109.0,1540.0,785.0,-200.0,-200.0,-200.0,2004-04-04 23:00:00
05/04/2004,00:00:00,-200.0,1102.0,150.0,,750.0,180.0,1007.0,109.0,1470.0,613.0,-200.0,-200.0,-200.0,2004-04-05 00:00:00
05/04/2004,01:00:00,-200.0,969.0,150.0,,611.0,180.0,1239.0,109.0,1330.0,430.0,-200.0,-200.0,-200.0,2004-04-05 01:00:00
05/04/2004,02:00:00,-200.0,983.0,150.0,,600.0,180.0,1233.0,109.0,1375.0,485.0,-200.0,-200.0,-200.0,2004-04-05 02:00:00
05/04/2004,03:00:00,-200.0,876.0,150.0,,505.0,180.0,1456.0,109.0,1294.0,467.0,-200.0,-200.0,-200.0,2004-04-05 03:00:00
05/04/2004,04:00:00,-200.0,884.0,150.0,,489.0,180.0,1536.0,109.0,1278.0,436.0,-200.0,-200.0,-200.0,2004-04-05 04:00:00
05/04/2004,05:00:00,-200.0,1024.0,150.0,,658.0,180.0,1175.0,109.0,1417.0,682.0,-200.0,-200.0,-200.0,2004-04-05 05:00:00
05/04/2004,06:00:00,-200.0,1126.0,150.0,,822.0,180.0,945.0,109.0,1541.0,927.0,-200.0,-200.0,-200.0,2004-04-05 06:00:00
05/04/2004,07:00:00,-200.0,1415.0,150.0,,1089.0,180.0,767.0,109.0,1795.0,1192.0,-200.0,-200.0,-200.0,2004-04-05 07:00:00
05/04/2004,08:00:00,-200.0,1631.0,150.0,,1449.0,180.0,570.0,109.0,2299.0,1615.0,-200.0,-200.0,-200.0,2004-04-05 08:00:00
05/04/2004,09:00:00,-200.0,1499.0,150.0,,1247.0,180.0,647.0,109.0,1972.0,1505.0,-200.0,-200.0,-200.0,2004-04-05 09:00:00
05/04/2004,10:00:00,-200.0,1461.0,424.0,,1127.0,236.0,703.0,124.0,1836.0,1451.0,-200.0,-200.0,-200.0,2004-04-05 10:00:00
05/04/2004,11:00:00,3.0,1430.0,339.0,,1107.0,228.0,713.0,121.0,1853.0,1409.0,-200.0,-200.0,-200.0,2004-04-05 11:00:00
05/04/2004,12:00:00,-200.0,1498.0,445.0,,1171.0,206.0,684.0,114.0,1942.0,1434.0,-200.0,-200.0,-200.0,2004-04-05 12:00:00
05/04/2004,13:00:00,-200.0,1454.0,535.0,,1162.0,188.0,682.0,114.0,1915.0,1457.0,-200.0,-200.0,-200.0,2004-04-05 13:00:00
05/04/2004,14:00:00,-200.0,1402.0,278.0,,1069.0,158.0,733.0,106.0,1793.0,1325.0,-200.0,-200.0,-200.0,2004-04-05 14:00:00
05/04/2004,15:00:00,-200.0,1327.0,256.0,,971.0,124.0,803.0,89.0,1705.0,1120.0,-200.0,-200.0,-200.0,2004-04-05 15:00:00
05/04/2004,16:00:00,2.0,1273.0,245.0,,963.0,98.0,832.0,82.0,1662.0,931.0,-200.0,-200.0,-200.0,2004-04-05 16:00:00
05/04/2004,17:00:00,-200.0,1457.0,458.0,,1190.0,160.0,678.0,111.0,1877.0,1212.0,-200.0,-200.0,-200.0,2004-04-05 17:00:00
05/04/2004,18:00:00,-200.0,1543.0,710.0,,1290.0,194.0,631.0,132.0,2011.0,1353.0,-200.0,-200.0,-200.0,2004-04-05 18:00:00
05/04/2004,19:00:00,-200.0,1499.0,678.0,,1239.0,174.0,651.0,121.0,1957.0,1359.0,-200.0,-200.0,-200.0,2004-04-05 19:00:00
05/04/2004,20:00:00,-200.0,1378.0,436.0,,1102.0,157.0,742.0,116.0,1796.0,1273.0,-200.0,-200.0,-200.0,2004-04-05 20:00:00
05/04/2004,21:00:00,2.0,1243.0,178.0,,928.0,109.0,852.0,100.0,1622.0,1079.0,-200.0,-200.0,-200.0,2004-04-05 21:00:00
05/04/2004,22:00:00,-200.0,1196.0,160.0,,885.0,85.0,884.0,89.0,1589.0,973.0,-200.0,-200.0,-200.0,2004-04-05 22:00:00
05/04/2004,23:00:00,-200.0,1137.0,177.0,,869.0,90.0,890.0,92.0,1554.0,951.0,-200.0,-200.0,-200.0,2004-04-05 23:00:00
06/04/2004,00:00:00,1.0,1015.0,101.0,,718.0,61.0,1065.0,71.0,1428.0,714.0,-200.0,-200.0,-200.0,2004-04-06 00:00:00
06/04/2004,01:00:00,-200.0,978.0,66.0,,635.0,36.0,1188.0,51.0,1382.0,579.0,-200.0,-200.0,-200.0,2004-04-06 01:00:00
06/04/2004,02:00:00,-200.0,933.0,40.0,,547.0,25.0,1357.0,39.0,1336.0,542.0,-200.0,-200.0,-200.0,2004-04-06 02:00:00
06/04/2004,03:00:00,-200.0,927.0,54.0,,579.0,180.0,1267.0,109.0,1370.0,562.0,-200.0,-200.0,-200.0,2004-04-06 03:00:00
06/04/2004,04:00:00,-200.0,908.0,39.0,,569.0,24.0,1303.0,35.0,1360.0,526.0,-200.0,-200.0,-200.0,2004-04-06 04:00:00
06/04/2004,05:00:00,-200.0,980.0,62.0,,677.0,73.0,1141.0,64.0,1435.0,659.0,-200.0,-200.0,-200.0,2004-04-06 05:00:00
06/04/2004,06:00:00,-200.0,1236.0,120.0,,920.0,164.0,880.0,94.0,1641.0,1012.0,-200.0,-200.0,-200.0,2004-04-06 06:00:00
06/04/2004,07:00:00,-200.0,1664.0,599.0,,1407.0,329.0,594.0,134.0,2198.0,1564.0,-200.0,-200.0,-200.0,2004-04-06 07:00:00
06/04/2004,08:00:00,-200.0,1757.0,1084.0,,1636.0,302.0,494.0,129.0,2560.0,1806.0,-200.0,-200.0,-200.0,2004-04-06 08:00:00
06/04/2004,09:00:00,-200.0,1524.0,776.0,,1350.0,256.0,588.0,125.0,2096.0,1604.0,-200.0,-200.0,-200.0,2004-04-06 09:00:00
06/04/2004,10:00:00,-200.0,1329.0,470.0,,1119.0,182.0,707.0,107.0,1823.0,1288.0,-200.0,-200.0,-200.0,2004-04-06 10:00:00
06/04/2004,11:00:00,-200.0,1167.0,169.0,,884.0,105.0,881.0,78.0,1580.0,931.0,-200.0,-200.0,-200.0,2004-04-06 11:00:00
06/04/2004,12:00:00,-200.0,1369.0,304.0,,1132.0,136.0,715.0,91.0,1818.0,1162.0,-200.0,-200.0,-200.0,2004-04-06 12:00:00
06/04/2004,13:00:00,-200.0,1284.0,405.0,,1103.0,167.0,755.0,116.0,1704.0,1064.0,-200.0,-200.0,-200.0,2004-04-06 13:00:00
06/04/2004,14:00:00,-200.0,1221.0,297.0,,1032.0,166.0,811.0,131.0,1630.0,913.0,-200.0,-200.0,-200.0,2004-04-06 14:00:00
06/04/2004,15:00:00,-200.0,1096.0,220.0,,947.0,115.0,872.0,113.0,1519.0,684.0,-200.0,-200.0,-200.0,2004-04-06 15:00:00
06/04/2004,16:00:00,-200.0,1143.0,226.0,,988.0,109.0,849.0,98.0,1590.0,710.0,-200.0,-200.0,-200.0,2004-04-06 16:00:00
06/04/2004,17:00:00,-200.0,1251.0,456.0,,1116.0,143.0,760.0,116.0,1716.0,923.0,-200.0,-200.0,-200.0,2004-04-06 17:00:00
06/04/2004,18:00:00,3.0,1268.0,470.0,,1148.0,159.0,728.0,120.0,1776.0,1006.0,-200.0,-200.0,-200.0,2004-04-06 18:00:00
06/04/2004,19:00:00,-200.0,1314.0,503.0,,1150.0,181.0,726.0,126.0,1784.0,1083.0,-200.0,-200.0,-200.0,2004-04-06 19:00:00
06/04/2004,20:00:00,-200.0,1315.0,459.0,,1142.0,178.0,724.0,126.0,1807.0,1161.0,-200.0,-200.0,-200.0,2004-04-06 20:00:00
06/04/2004,21:00:00,-200.0,1095.0,227.0,,918.0,91.0,896.0,90.0,1527.0,800.0,-200.0,-200.0,-200.0,2004-04-06 21:00:00
06/04/2004,22:00:00,-200.0,1027.0,152.0,,808.0,76.0,996.0,81.0,1458.0,647.0,-200.0,-200.0,-200.0,2004-04-06 22:00:00
06/04/2004,23:00:00,-200.0,1012.0,94.0,,752.0,66.0,1053.0,74.0,1393.0,649.0,-200.0,-200.0,-200.0,2004-04-06 23:00:00
07/04/2004,00:00:00,-200.0,948.0,93.0,,710.0,56.0,1127.0,67.0,1352.0,575.0,-200.0,-200.0,-200.0,2004-04-07 00:00:00
07/04/2004,01:00:00,-200.0,889.0,49.0,,603.0,35.0,1308.0,46.0,1271.0,455.0,-200.0,-200.0,-200.0,2004-04-07 01:00:00
07/04/2004,02:00:00,-200.0,830.0,30.0,,538.0,21.0,1475.0,30.0,1214.0,392.0,-200.0,-200.0,-200.0,2004-04-07 02:00:00
07/04/2004,03:00:00,-200.0,801.0,30.0,,464.0,180.0,1749.0,109.0,1154.0,340.0,-200.0,-200.0,-200.0,2004-04-07 03:00:00
07/04/2004,04:00:00,-200.0,804.0,30.0,,468.0,12.0,1826.0,19.0,1166.0,320.0,-200.0,-200.0,-200.0,2004-04-07 04:00:00
07/04/2004,05:00:00,-200.0,824.0,32.0,,478.0,22.0,1705.0,32.0,1200.0,331.0,-200.0,-200.0,-200.0,2004-04-07 05:00:00
07/04/2004,06:00:00,-200.0,1000.0,59.0,,688.0,55.0,1257.0,61.0,1398.0,426.0,-200.0,-200.0,-200.0,2004-04-07 06:00:00
07/04/2004,07:00:00,-200.0,1307.0,277.0,,1082.0,152.0,777.0,111.0,1769.0,830.0,-200.0,-200.0,-200.0,2004-04-07 07:00:00
07/04/2004,08:00:00,-200.0,1286.0,454.0,,1171.0,153.0,716.0,102.0,1821.0,1006.0,-200.0,-200.0,-200.0,2004-04-07 08:00:00
07/04/2004,09:00:00,-200.0,1150.0,211.0,,925.0,152.0,865.0,116.0,1576.0,820.0,-200.0,-200.0,-200.0,2004-04-07 09:00:00
07/04/2004,10:00:00,-200.0,1087.0,196.0,,876.0,112.0,911.0,96.0,1554.0,737.0,-200.0,-200.0,-200.0,2004-04-07 10:00:00
07/04/2004,11:00:00,-200.0,1016.0,110.0,,839.0,119.0,991.0,97.0,1448.0,790.0,-200.0,-200.0,-200.0,2004-04-07 11:00:00
07/04/2004,12:00:00,-200.0,1029.0,164.0,,892.0,122.0,937.0,110.0,1474.0,760.0,-200.0,-200.0,-200.0,2004-04-07 12:00:00
07/04/2004,13:00:00,-200.0,1109.0,151.0,,943.0,115.0,883.0,103.0,1604.0,767.0,-200.0,-200.0,-200.0,2004-04-07 13:00:00
07/04/2004,14:00:00,-200.0,997.0,112.0,,817.0,84.0,1030.0,79.0,1426.0,626.0,-200.0,-200.0,-200.0,2004-04-07 14:00:00
07/04/2004,15:00:00,-200.0,1177.0,117.0,,880.0,146.0,927.0,104.0,1552.0,776.0,-200.0,-200.0,-200.0,2004-04-07 15:00:00
07/04/2004,16:00:00,-200.0,1045.0,120.0,,808.0,65.0,1038.0,69.0,1421.0,589.0,-200.0,-200.0,-200.0,2004-04-07 16:00:00
07/04/2004,17:00:00,-200.0,1171.0,251.0,,1073.0,120.0,847.0,96.0,1623.0,872.0,-200.0,-200.0,-200.0,2004-04-07 17:00:00
07/04/2004,18:00:00,-200.0,1221.0,435.0,,1101.0,185.0,799.0,121.0,1700.0,996.0,-200.0,-200.0,-200.0,2004-04-07 18:00:00
07/04/2004,19:00:00,-200.0,1262.0,345.0,,1133.0,157.0,774.0,129.0,1748.0,1033.0,-200.0,-200.0,-200.0,2004-04-07 19:00:00
07/04/2004,20:00:00,-200.0,1207.0,343.0,,1013.0,174.0,876.0,116.0,1632.0,982.0,-200.0,-200.0,-200.0,2004-04-07 20:00:00
07/04/2004,21:00:00,-200.0,956.0,62.0,,666.0,62.0,1235.0,71.0,1282.0,518.0,-200.0,-200.0,-200.0,2004-04-07 21:00:00
07/04/2004,22:00:00,-200.0,1020.0,70.0,,727.0,81.0,1153.0,85.0,1391.0,631.0,-200.0,-200.0,-200.0,2004-04-07 22:00:00
07/04/2004,23:00:00,-200.0,1107.0,114.0,,861.0,118.0,957.0,101.0,1510.0,879.0,-200.0,-200.0,-200.0,2004-04-07 23:00:00
08/04/2004,00:00:00,-200.0,1020.0,88.0,,752.0,95.0,1074.0,97.0,1398.0,839.0,-200.0,-200.0,-200.0,2004-04-08 00:00:00
08/04/2004,01:00:00,-200.0,1051.0,95.0,,798.0,84.0,1016.0,89.0,1455.0,876.0,-200.0,-200.0,-200.0,2004-04-08 01:00:00
08/04/2004,02:00:00,-200.0,965.0,83.0,,716.0,56.0,1087.0,72.0,1383.0,827.0,-200.0,-200.0,-200.0,2004-04-08 02:00:00
08/04/2004,03:00:00,-200.0,890.0,63.0,,672.0,180.0,1183.0,109.0,1338.0,781.0,-200.0,-200.0,-200.0,2004-04-08 03:00:00
08/04/2004,04:00:00,-200.0,823.0,38.0,,568.0,43.0,1366.0,57.0,1263.0,699.0,-200.0,-200.0,-200.0,2004-04-08 04:00:00
08/04/2004,05:00:00,-200.0,869.0,68.0,,642.0,69.0,1291.0,62.0,1288.0,723.0,-200.0,-200.0,-200.0,2004-04-08 05:00:00
08/04/2004,06:00:00,-200.0,939.0,59.0,,754.0,74.0,1169.0,64.0,1384.0,797.0,-200.0,-200.0,-200.0,2004-04-08 06:00:00
08/04/2004,07:00:00,-200.0,1274.0,226.0,,1109.0,161.0,820.0,80.0,1723.0,1138.0,-200.0,-200.0,-200.0,2004-04-08 07:00:00
08/04/2004,08:00:00,-200.0,1512.0,802.0,,1482.0,308.0,596.0,118.0,2189.0,1605.0,-200.0,-200.0,-200.0,2004-04-08 08:00:00
08/04/2004,09:00:00,-200.0,1435.0,585.0,,1271.0,300.0,676.0,130.0,1885.0,1569.0,-200.0,-200.0,-200.0,2004-04-08 09:00:00
08/04/2004,10:00:00,-200.0,1207.0,324.0,,1041.0,189.0,813.0,113.0,1620.0,1319.0,-200.0,-200.0,-200.0,2004-04-08 10:00:00
08/04/2004,11:00:00,-200.0,1223.0,308.0,,1075.0,164.0,818.0,112.0,1678.0,1198.0,-200.0,-200.0,-200.0,2004-04-08 11:00:00
08/04/2004,12:00:00,-200.0,1121.0,238.0,,1026.0,122.0,865.0,96.0,1541.0,958.0,-200.0,-200.0,-200.0,2004-04-08 12:00:00
08/04/2004,13:00:00,-200.0,1176.0,301.0,,1123.0,166.0,816.0,125.0,1609.0,1068.0,-200.0,-200.0,-200.0,2004-04-08 13:00:00
08/04/2004,14:00:00,-200.0,1144.0,294.0,,1114.0,181.0,845.0,128.0,1551.0,1010.0,-200.0,-200.0,-200.0,2004-04-08 14:00:00
08/04/2004,15:00:00,-200.0,1136.0,353.0,,1089.0,127.0,856.0,101.0,1552.0,928.0,-200.0,-200.0,-200.0,2004-04-08 15:00:00
08/04/2004,16:00:00,-200.0,1085.0,209.0,,1004.0,106.0,888.0,95.0,1454.0,816.0,-200.0,-200.0,-200.0,2004-04-08 16:00:00
08/04/2004,17:00:00,-200.0,1297.0,538.0,,1287.0,192.0,723.0,138.0,1798.0,1216.0,-200.0,-200.0,-200.0,2004-04-08 17:00:00
08/04/2004,18:00:00,-200.0,1408.0,808.0,,1404.0,241.0,646.0,154.0,1972.0,1463.0,-200.0,-200.0,-200.0,2004-04-08 18:00:00
08/04/2004,19:00:00,-200.0,1618.0,974.0,,1530.0,326.0,579.0,171.0,2167.0,1791.0,-200.0,-200.0,-200.0,2004-04-08 19:00:00
08/04/2004,20:00:00,-200.0,1319.0,544.0,,1172.0,232.0,746.0,136.0,1699.0,1425.0,-200.0,-200.0,-200.0,2004-04-08 20:00:00
08/04/2004,21:00:00,-200.0,1045.0,138.0,,857.0,92.0,968.0,93.0,1410.0,922.0,-200.0,-200.0,-200.0,2004-04-08 21:00:00
08/04/2004,22:00:00,-200.0,1058.0,92.0,,824.0,95.0,993.0,99.0,1411.0,971.0,-200.0,-200.0,-200.0,2004-04-08 22:00:00
08/04/2004,23:00:00,2.0,1063.0,137.0,,909.0,129.0,806.0,106.0,1463.0,963.0,-200.0,-200.0,-200.0,2004-04-08 23:00:00
09/04/2004,00:00:00,-200.0,1063.0,189.0,,909.0,154.0,806.0,109.0,1463.0,963.0,-200.0,-200.0,-200.0,2004-04-09 00:00:00
09/04/2004,01:00:00,-200.0,1063.0,159.0,,909.0,118.0,806.0,97.0,1463.0,963.0,-200.0,-200.0,-200.0,2004-04-09 01:00:00
09/04/2004,02:00:00,1.0,1063.0,80.0,,909.0,69.0,806.0,83.0,1463.0,963.0,-200.0,-200.0,-200.0,2004-04-09 02:00:00
09/04/2004,03:00:00,1.0,1063.0,66.0,,909.0,180.0,806.0,109.0,1463.0,963.0,-200.0,-200.0,-200.0,2004-04-09 03:00:00
09/04/2004,04:00:00,1.0,1063.0,87.0,,909.0,97.0,806.0,79.0,1463.0,963.0,-200.0,-200.0,-200.0,2004-04-09 04:00:00
09/04/2004,05:00:00,-200.0,1063.0,79.0,,909.0,145.0,806.0,84.0,1463.0,963.0,-200.0,-200.0,-200.0,2004-04-09 05:00:00
09/04/2004,06:00:00,-200.0,1063.0,150.0,,909.0,169.0,806.0,86.0,1463.0,963.0,-200.0,-200.0,-200.0,2004-04-09 06:00:00
09/04/2004,07:00:00,-200.0,1063.0,196.0,,909.0,250.0,806.0,111.0,1463.0,963.0,-200.0,-200.0,-200.0,2004-04-09 07:00:00
09/04/2004,08:00:00,-200.0,1063.0,299.0,,909.0,215.0,806.0,117.0,1463.0,963.0,-200.0,-200.0,-200.0,2004-04-09 08:00:00
09/04/2004,09:00:00,-200.0,1063.0,254.0,,909.0,237.0,806.0,122.0,1463.0,963.0,-200.0,-200.0,-200.0,2004-04-09 09:00:00
09/04/2004,10:00:00,-200.0,1063.0,226.0,,909.0,190.0,806.0,119.0,1463.0,963.0,-200.0,-200.0,-200.0,2004-04-09 10:00:00
09/04/2004,11:00:00,-200.0,1063.0,262.0,,909.0,219.0,806.0,121.0,1463.0,963.0,-200.0,-200.0,-200.0,2004-04-09 11:00:00
09/04/2004,12:00:00,-200.0,1063.0,505.0,,909.0,294.0,806.0,127.0,1463.0,963.0,-200.0,-200.0,-200.0,2004-04-09 12:00:00
09/04/2004,13:00:00,-200.0,1063.0,512.0,,909.0,253.0,806.0,135.0,1463.0,963.0,-200.0,-200.0,-200.0,2004-04-09 13:00:00
09/04/2004,14:00:00,-200.0,1063.0,159.0,,909.0,176.0,806.0,119.0,1463.0,963.0,-200.0,-200.0,-200.0,2004-04-09 14:00:00
09/04/2004,15:00:00,-200.0,1063.0,337.0,,909.0,243.0,806.0,137.0,1463.0,963.0,-200.0,-200.0,-200.0,2004-04-09 15:00:00
09/04/2004,16:00:00,-200.0,1063.0,357.0,,909.0,214.0,806.0,139.0,1463.0,963.0,-200.0,-200.0,-200.0,2004-04-09 16:00:00
09/04/2004,17:00:00,-200.0,1063.0,194.0,,909.0,141.0,806.0,117.0,1463.0,963.0,-200.0,-200.0,-200.0,2004-04-09 17:00:00
09/04/2004,18:00:00,-200.0,1063.0,278.0,,909.0,166.0,806.0,127.0,1463.0,963.0,-200.0,-200.0,-200.0,2004-04-09 18:00:00
09/04/2004,19:00:00,-200.0,1063.0,303.0,,909.0,197.0,806.0,137.0,1463.0,963.0,-200.0,-200.0,-200.0,2004-04-09 19:00:00
09/04/2004,20:00:00,3.0,1063.0,234.0,,909.0,191.0,806.0,127.0,1463.0,963.0,-200.0,-200.0,-200.0,2004-04-09 20:00:00
09/04/2004,21:00:00,-200.0,1063.0,128.0,,909.0,159.0,806.0,107.0,1463.0,963.0,-200.0,-200.0,-200.0,2004-04-09 21:00:00
09/04/2004,22:00:00,-200.0,1063.0,160.0,,909.0,175.0,806.0,102.0,1463.0,963.0,-200.0,-200.0,-200.0,2004-04-09 22:00:00
09/04/2004,23:00:00,-200.0,1176.0,169.0,,917.0,157.0,866.0,95.0,1560.0,1151.0,-200.0,-200.0,-200.0,2004-04-09 23:00:00
10/04/2004,00:00:00,-200.0,1047.0,77.0,,783.0,83.0,1014.0,79.0,1449.0,975.0,-200.0,-200.0,-200.0,2004-04-10 00:00:00
10/04/2004,01:00:00,-200.0,1116.0,98.0,,854.0,118.0,929.0,78.0,1533.0,1034.0,-200.0,-200.0,-200.0,2004-04-10 01:00:00
10/04/2004,02:00:00,-200.0,1074.0,102.0,,832.0,101.0,951.0,75.0,1507.0,980.0,-200.0,-200.0,-200.0,2004-04-10 02:00:00
10/04/2004,03:00:00,1.0,922.0,65.0,,687.0,180.0,1142.0,109.0,1390.0,825.0,-200.0,-200.0,-200.0,2004-04-10 03:00:00
10/04/2004,04:00:00,-200.0,898.0,69.0,,669.0,46.0,1163.0,52.0,1386.0,807.0,-200.0,-200.0,-200.0,2004-04-10 04:00:00
10/04/2004,05:00:00,1.0,970.0,89.0,,708.0,81.0,1121.0,55.0,1435.0,842.0,-200.0,-200.0,-200.0,2004-04-10 05:00:00
10/04/2004,06:00:00,-200.0,1073.0,134.0,,812.0,112.0,988.0,65.0,1500.0,950.0,-200.0,-200.0,-200.0,2004-04-10 06:00:00
10/04/2004,07:00:00,-200.0,1081.0,157.0,,906.0,150.0,895.0,72.0,1591.0,1024.0,-200.0,-200.0,-200.0,2004-04-10 07:00:00
10/04/2004,08:00:00,2.0,1159.0,167.0,,976.0,138.0,837.0,76.0,1663.0,1098.0,-200.0,-200.0,-200.0,2004-04-10 08:00:00
10/04/2004,09:00:00,2.0,1112.0,157.0,,931.0,124.0,869.0,84.0,1588.0,1011.0,-200.0,-200.0,-200.0,2004-04-10 09:00:00
10/04/2004,10:00:00,-200.0,1112.0,172.0,,917.0,124.0,897.0,90.0,1542.0,931.0,-200.0,-200.0,-200.0,2004-04-10 10:00:00
10/04/2004,11:00:00,-200.0,1063.0,114.0,,877.0,115.0,971.0,89.0,1481.0,811.0,-200.0,-200.0,-200.0,2004-04-10 11:00:00
10/04/2004,12:00:00,-200.0,1032.0,166.0,,892.0,101.0,973.0,87.0,1457.0,756.0,-200.0,-200.0,-200.0,2004-04-10 12:00:00
10/04/2004,13:00:00,-200.0,936.0,94.0,,829.0,90.0,1054.0,88.0,1336.0,607.0,-200.0,-200.0,-200.0,2004-04-10 13:00:00
10/04/2004,14:00:00,-200.0,883.0,108.0,,766.0,90.0,1152.0,81.0,1238.0,498.0,-200.0,-200.0,-200.0,2004-04-10 14:00:00
10/04/2004,15:00:00,-200.0,942.0,98.0,,852.0,89.0,1055.0,89.0,1318.0,540.0,-200.0,-200.0,-200.0,2004-04-10 15:00:00
10/04/2004,16:00:00,-200.0,943.0,132.0,,850.0,92.0,1084.0,91.0,1296.0,544.0,-200.0,-200.0,-200.0,2004-04-10 16:00:00
10/04/2004,17:00:00,-200.0,1007.0,144.0,,875.0,103.0,1027.0,104.0,1357.0,620.0,-200.0,-200.0,-200.0,2004-04-10 17:00:00
10/04/2004,18:00:00,2.0,1037.0,165.0,,927.0,122.0,949.0,111.0,1426.0,740.0,-200.0,-200.0,-200.0,2004-04-10 18:00:00
10/04/2004,19:00:00,-200.0,1127.0,210.0,,1022.0,159.0,871.0,129.0,1534.0,921.0,-200.0,-200.0,-200.0,2004-04-10 19:00:00
10/04/2004,20:00:00,-200.0,1123.0,277.0,,996.0,172.0,861.0,133.0,1551.0,1033.0,-200.0,-200.0,-200.0,2004-04-10 20:00:00
10/04/2004,21:00:00,2.0,1110.0,168.0,,909.0,125.0,916.0,115.0,1487.0,984.0,-200.0,-200.0,-200.0,2004-04-10 21:00:00
10/04/2004,22:00:00,-200.0,1247.0,248.0,,1037.0,187.0,812.0,125.0,1618.0,1193.0,-200.0,-200.0,-200.0,2004-04-10 22:00:00
10/04/2004,23:00:00,-200.0,1220.0,235.0,,967.0,174.0,844.0,117.0,1545.0,1219.0,-200.0,-200.0,-200.0,2004-04-10 23:00:00
11/04/2004,00:00:00,-200.0,1028.0,84.0,,770.0,75.0,1047.0,84.0,1326.0,913.0,-200.0,-200.0,-200.0,2004-04-11 00:00:00
11/04/2004,01:00:00,-200.0,978.0,75.0,,711.0,48.0,1144.0,63.0,1304.0,750.0,-200.0,-200.0,-200.0,2004-04-11 01:00:00
11/04/2004,02:00:00,1.0,949.0,62.0,,694.0,61.0,1160.0,68.0,1310.0,772.0,-200.0,-200.0,-200.0,2004-04-11 02:00:00
11/04/2004,03:00:00,1.0,910.0,66.0,,709.0,180.0,1162.0,109.0,1329.0,712.0,-200.0,-200.0,-200.0,2004-04-11 03:00:00
11/04/2004,04:00:00,-200.0,863.0,49.0,,651.0,38.0,1224.0,52.0,1286.0,712.0,-200.0,-200.0,-200.0,2004-04-11 04:00:00
11/04/2004,05:00:00,-200.0,836.0,38.0,,643.0,38.0,1244.0,49.0,1306.0,727.0,-200.0,-200.0,-200.0,2004-04-11 05:00:00
11/04/2004,06:00:00,-200.0,856.0,44.0,,644.0,41.0,1259.0,49.0,1301.0,746.0,-200.0,-200.0,-200.0,2004-04-11 06:00:00
11/04/2004,07:00:00,-200.0,888.0,60.0,,651.0,51.0,1240.0,52.0,1298.0,733.0,-200.0,-200.0,-200.0,2004-04-11 07:00:00
11/04/2004,08:00:00,-200.0,912.0,88.0,,694.0,61.0,1196.0,58.0,1343.0,727.0,-200.0,-200.0,-200.0,2004-04-11 08:00:00
11/04/2004,09:00:00,1.0,938.0,70.0,,706.0,47.0,1177.0,51.0,1320.0,642.0,-200.0,-200.0,-200.0,2004-04-11 09:00:00
11/04/2004,10:00:00,-200.0,1053.0,94.0,,823.0,87.0,1040.0,77.0,1386.0,810.0,-200.0,-200.0,-200.0,2004-04-11 10:00:00
11/04/2004,11:00:00,-200.0,1087.0,126.0,,870.0,107.0,1014.0,90.0,1412.0,851.0,-200.0,-200.0,-200.0,2004-04-11 11:00:00
11/04/2004,12:00:00,-200.0,1153.0,181.0,,945.0,161.0,969.0,118.0,1425.0,911.0,-200.0,-200.0,-200.0,2004-04-11 12:00:00
11/04/2004,13:00:00,-200.0,894.0,66.0,,710.0,61.0,1209.0,70.0,1200.0,611.0,-200.0,-200.0,-200.0,2004-04-11 13:00:00
11/04/2004,14:00:00,-200.0,797.0,54.0,,606.0,26.0,1452.0,35.0,1076.0,368.0,-200.0,-200.0,-200.0,2004-04-11 14:00:00
11/04/2004,15:00:00,-200.0,854.0,48.0,,658.0,42.0,1409.0,46.0,1108.0,369.0,-200.0,-200.0,-200.0,2004-04-11 15:00:00
11/04/2004,16:00:00,1.0,892.0,66.0,,665.0,55.0,1348.0,58.0,1150.0,394.0,-200.0,-200.0,-200.0,2004-04-11 16:00:00
11/04/2004,17:00:00,-200.0,935.0,65.0,,672.0,65.0,1299.0,61.0,1183.0,415.0,-200.0,-200.0,-200.0,2004-04-11 17:00:00
11/04/2004,18:00:00,-200.0,989.0,68.0,,709.0,75.0,1225.0,80.0,1233.0,469.0,-200.0,-200.0,-200.0,2004-04-11 18:00:00
11/04/2004,19:00:00,2.0,1063.0,118.0,,797.0,93.0,1079.0,93.0,1285.0,607.0,-200.0,-200.0,-200.0,2004-04-11 19:00:00
11/04/2004,20:00:00,-200.0,922.0,65.0,,674.0,63.0,1220.0,78.0,1205.0,498.0,-200.0,-200.0,-200.0,2004-04-11 20:00:00
11/04/2004,21:00:00,-200.0,925.0,63.0,,680.0,60.0,1223.0,76.0,1217.0,481.0,-200.0,-200.0,-200.0,2004-04-11 21:00:00
11/04/2004,22:00:00,-200.0,924.0,61.0,,648.0,63.0,1272.0,74.0,1186.0,465.0,-200.0,-200.0,-200.0,2004-04-11 22:00:00
11/04/2004,23:00:00,-200.0,914.0,63.0,,661.0,66.0,1256.0,81.0,1187.0,478.0,-200.0,-200.0,-200.0,2004-04-11 23:00:00
12/04/2004,00:00:00,-200.0,840.0,31.0,,556.0,41.0,1474.0,58.0,1094.0,366.0,-200.0,-200.0,-200.0,2004-04-12 00:00:00
12/04/2004,01:00:00,-200.0,799.0,29.0,,514.0,42.0,1615.0,59.0,1036.0,332.0,-200.0,-200.0,-200.0,2004-04-12 01:00:00
12/04/2004,02:00:00,-200.0,856.0,34.0,,581.0,36.0,1448.0,54.0,1111.0,346.0,-200.0,-200.0,-200.0,2004-04-12 02:00:00
12/04/2004,03:00:00,-200.0,830.0,34.0,,560.0,180.0,1452.0,109.0,1066.0,350.0,-200.0,-200.0,-200.0,2004-04-12 03:00:00
12/04/2004,04:00:00,-200.0,753.0,9.0,,462.0,16.0,1822.0,25.0,955.0,274.0,-200.0,-200.0,-200.0,2004-04-12 04:00:00
12/04/2004,05:00:00,-200.0,785.0,14.0,,448.0,16.0,1923.0,26.0,1003.0,263.0,-200.0,-200.0,-200.0,2004-04-12 05:00:00
12/04/2004,06:00:00,-200.0,835.0,23.0,,472.0,33.0,1756.0,49.0,1117.0,314.0,-200.0,-200.0,-200.0,2004-04-12 06:00:00
12/04/2004,07:00:00,-200.0,865.0,36.0,,494.0,39.0,1613.0,53.0,1185.0,367.0,-200.0,-200.0,-200.0,2004-04-12 07:00:00
12/04/2004,08:00:00,-200.0,922.0,39.0,,541.0,45.0,1453.0,57.0,1246.0,432.0,-200.0,-200.0,-200.0,2004-04-12 08:00:00
12/04/2004,09:00:00,-200.0,975.0,38.0,,598.0,63.0,1268.0,73.0,1293.0,536.0,-200.0,-200.0,-200.0,2004-04-12 09:00:00
12/04/2004,10:00:00,1.0,1040.0,55.0,,646.0,71.0,1210.0,78.0,1325.0,555.0,-200.0,-200.0,-200.0,2004-04-12 10:00:00
12/04/2004,11:00:00,-200.0,1115.0,75.0,,707.0,104.0,1105.0,93.0,1384.0,677.0,-200.0,-200.0,-200.0,2004-04-12 11:00:00
12/04/2004,12:00:00,-200.0,1004.0,64.0,,641.0,85.0,1201.0,71.0,1305.0,557.0,-200.0,-200.0,-200.0,2004-04-12 12:00:00
12/04/2004,13:00:00,-200.0,895.0,39.0,,536.0,53.0,1415.0,56.0,1229.0,421.0,-200.0,-200.0,-200.0,2004-04-12 13:00:00
12/04/2004,14:00:00,-200.0,917.0,42.0,,563.0,58.0,1415.0,60.0,1257.0,423.0,-200.0,-200.0,-200.0,2004-04-12 14:00:00
12/04/2004,15:00:00,-200.0,1025.0,78.0,,689.0,89.0,1189.0,77.0,1325.0,519.0,-200.0,-200.0,-200.0,2004-04-12 15:00:00
12/04/2004,16:00:00,-200.0,1035.0,69.0,,660.0,96.0,1222.0,82.0,1301.0,533.0,-200.0,-200.0,-200.0,2004-04-12 16:00:00
12/04/2004,17:00:00,-200.0,1025.0,67.0,,682.0,88.0,1197.0,77.0,1313.0,537.0,-200.0,-200.0,-200.0,2004-04-12 17:00:00
12/04/2004,18:00:00,-200.0,1040.0,83.0,,705.0,100.0,1149.0,91.0,1324.0,612.0,-200.0,-200.0,-200.0,2004-04-12 18:00:00
12/04/2004,19:00:00,-200.0,1070.0,79.0,,776.0,127.0,1065.0,93.0,1369.0,697.0,-200.0,-200.0,-200.0,2004-04-12 19:00:00
12/04/2004,20:00:00,-200.0,964.0,68.0,,692.0,88.0,1176.0,82.0,1292.0,573.0,-200.0,-200.0,-200.0,2004-04-12 20:00:00
12/04/2004,21:00:00,-200.0,904.0,56.0,,635.0,66.0,1269.0,74.0,1233.0,489.0,-200.0,-200.0,-200.0,2004-04-12 21:00:00
12/04/2004,22:00:00,-200.0,913.0,49.0,,626.0,61.0,1271.0,68.0,1234.0,474.0,-200.0,-200.0,-200.0,2004-04-12 22:00:00
12/04/2004,23:00:00,-200.0,914.0,56.0,,610.0,54.0,1322.0,65.0,1230.0,455.0,-200.0,-200.0,-200.0,2004-04-12 23:00:00
13/04/2004,00:00:00,-200.0,893.0,48.0,,587.0,46.0,1368.0,58.0,1219.0,433.0,-200.0,-200.0,-200.0,2004-04-13 00:00:00
13/04/2004,01:00:00,-200.0,844.0,27.0,,532.0,25.0,1499.0,36.0,1176.0,376.0,-200.0,-200.0,-200.0,2004-04-13 01:00:00
13/04/2004,02:00:00,-200.0,837.0,29.0,,518.0,18.0,1581.0,29.0,1182.0,360.0,-200.0,-200.0,-200.0,2004-04-13 02:00:00
13/04/2004,03:00:00,-200.0,868.0,32.0,,530.0,180.0,1482.0,109.0,1215.0,384.0,-200.0,-200.0,-200.0,2004-04-13 03:00:00
13/04/2004,04:00:00,-200.0,825.0,47.0,,489.0,21.0,1565.0,28.0,1171.0,363.0,-200.0,-200.0,-200.0,2004-04-13 04:00:00
13/04/2004,05:00:00,-200.0,956.0,66.0,,656.0,76.0,1251.0,68.0,1356.0,525.0,-200.0,-200.0,-200.0,2004-04-13 05:00:00
13/04/2004,06:00:00,-200.0,1124.0,163.0,,853.0,149.0,960.0,99.0,1531.0,873.0,-200.0,-200.0,-200.0,2004-04-13 06:00:00
13/04/2004,07:00:00,-200.0,1496.0,524.0,,1272.0,328.0,667.0,130.0,2011.0,1399.0,-200.0,-200.0,-200.0,2004-04-13 07:00:00
13/04/2004,08:00:00,-200.0,1452.0,657.0,,1354.0,282.0,620.0,128.0,2057.0,1501.0,-200.0,-200.0,-200.0,2004-04-13 08:00:00
13/04/2004,09:00:00,-200.0,1172.0,324.0,,1042.0,206.0,797.0,120.0,1641.0,1186.0,-200.0,-200.0,-200.0,2004-04-13 09:00:00
13/04/2004,10:00:00,-200.0,1020.0,144.0,,871.0,133.0,956.0,93.0,1426.0,911.0,-200.0,-200.0,-200.0,2004-04-13 10:00:00
13/04/2004,11:00:00,-200.0,1044.0,135.0,,900.0,137.0,934.0,96.0,1471.0,919.0,-200.0,-200.0,-200.0,2004-04-13 11:00:00
13/04/2004,12:00:00,-200.0,1020.0,140.0,,866.0,116.0,972.0,84.0,1429.0,791.0,-200.0,-200.0,-200.0,2004-04-13 12:00:00
13/04/2004,13:00:00,-200.0,1009.0,141.0,,885.0,112.0,994.0,87.0,1439.0,751.0,-200.0,-200.0,-200.0,2004-04-13 13:00:00
13/04/2004,14:00:00,-200.0,1073.0,181.0,,966.0,128.0,935.0,87.0,1537.0,805.0,-200.0,-200.0,-200.0,2004-04-13 14:00:00
13/04/2004,15:00:00,-200.0,1098.0,227.0,,971.0,145.0,877.0,103.0,1527.0,966.0,-200.0,-200.0,-200.0,2004-04-13 15:00:00
13/04/2004,16:00:00,-200.0,1061.0,149.0,,887.0,110.0,920.0,88.0,1462.0,869.0,-200.0,-200.0,-200.0,2004-04-13 16:00:00
13/04/2004,17:00:00,3.0,1289.0,425.0,,1158.0,184.0,755.0,118.0,1791.0,1196.0,-200.0,-200.0,-200.0,2004-04-13 17:00:00
13/04/2004,18:00:00,-200.0,1442.0,669.0,,1337.0,243.0,630.0,134.0,2004.0,1523.0,-200.0,-200.0,-200.0,2004-04-13 18:00:00
13/04/2004,19:00:00,5.0,1479.0,680.0,,1343.0,259.0,631.0,144.0,1995.0,1579.0,-200.0,-200.0,-200.0,2004-04-13 19:00:00
13/04/2004,20:00:00,-200.0,1266.0,446.0,,1138.0,205.0,726.0,129.0,1747.0,1370.0,-200.0,-200.0,-200.0,2004-04-13 20:00:00
13/04/2004,21:00:00,-200.0,1149.0,205.0,,952.0,144.0,845.0,108.0,1577.0,1204.0,-200.0,-200.0,-200.0,2004-04-13 21:00:00
13/04/2004,22:00:00,-200.0,1168.0,194.0,,954.0,152.0,843.0,104.0,1586.0,1201.0,-200.0,-200.0,-200.0,2004-04-13 22:00:00
13/04/2004,23:00:00,-200.0,1079.0,115.0,,847.0,108.0,925.0,90.0,1463.0,1122.0,-200.0,-200.0,-200.0,2004-04-13 23:00:00
14/04/2004,00:00:00,-200.0,1047.0,74.0,,760.0,64.0,1032.0,74.0,1379.0,1003.0,-200.0,-200.0,-200.0,2004-04-14 00:00:00
14/04/2004,01:00:00,-200.0,936.0,85.0,,705.0,73.0,1086.0,73.0,1364.0,918.0,-200.0,-200.0,-200.0,2004-04-14 01:00:00
14/04/2004,02:00:00,-200.0,900.0,66.0,,635.0,47.0,1207.0,60.0,1307.0,836.0,-200.0,-200.0,-200.0,2004-04-14 02:00:00
14/04/2004,03:00:00,-200.0,839.0,60.0,,576.0,180.0,1325.0,109.0,1285.0,759.0,-200.0,-200.0,-200.0,2004-04-14 03:00:00
14/04/2004,04:00:00,-200.0,840.0,40.0,,563.0,45.0,1349.0,57.0,1275.0,755.0,-200.0,-200.0,-200.0,2004-04-14 04:00:00
14/04/2004,05:00:00,-200.0,905.0,47.0,,670.0,79.0,1191.0,62.0,1346.0,820.0,-200.0,-200.0,-200.0,2004-04-14 05:00:00
14/04/2004,06:00:00,-200.0,1079.0,116.0,,875.0,113.0,947.0,71.0,1535.0,998.0,-200.0,-200.0,-200.0,2004-04-14 06:00:00
14/04/2004,07:00:00,-200.0,1417.0,478.0,,1246.0,263.0,669.0,94.0,1921.0,1403.0,-200.0,-200.0,-200.0,2004-04-14 07:00:00
14/04/2004,08:00:00,5.0,1529.0,836.0,,1497.0,275.0,569.0,99.0,2278.0,1641.0,-200.0,-200.0,-200.0,2004-04-14 08:00:00
14/04/2004,09:00:00,-200.0,1397.0,655.0,,1248.0,263.0,659.0,119.0,1906.0,1534.0,-200.0,-200.0,-200.0,2004-04-14 09:00:00
14/04/2004,10:00:00,-200.0,1214.0,312.0,,1061.0,183.0,780.0,103.0,1662.0,1257.0,-200.0,-200.0,-200.0,2004-04-14 10:00:00
14/04/2004,11:00:00,-200.0,1109.0,195.0,,935.0,147.0,882.0,95.0,1518.0,1026.0,-200.0,-200.0,-200.0,2004-04-14 11:00:00
14/04/2004,12:00:00,-200.0,1122.0,238.0,,993.0,132.0,859.0,95.0,1571.0,993.0,-200.0,-200.0,-200.0,2004-04-14 12:00:00
14/04/2004,13:00:00,-200.0,1094.0,150.0,,966.0,180.0,877.0,109.0,1519.0,919.0,-200.0,-200.0,-200.0,2004-04-14 13:00:00
14/04/2004,14:00:00,-200.0,1164.0,150.0,,1076.0,180.0,788.0,109.0,1653.0,1032.0,-200.0,-200.0,-200.0,2004-04-14 14:00:00
14/04/2004,15:00:00,-200.0,1188.0,150.0,,1082.0,180.0,790.0,109.0,1653.0,1077.0,-200.0,-200.0,-200.0,2004-04-14 15:00:00
14/04/2004,16:00:00,-200.0,1098.0,150.0,,934.0,180.0,895.0,109.0,1497.0,883.0,-200.0,-200.0,-200.0,2004-04-14 16:00:00
14/04/2004,17:00:00,-200.0,1180.0,150.0,,1014.0,180.0,826.0,109.0,1595.0,1036.0,-200.0,-200.0,-200.0,2004-04-14 17:00:00
14/04/2004,18:00:00,-200.0,1195.0,150.0,,1072.0,180.0,799.0,109.0,1609.0,1144.0,-200.0,-200.0,-200.0,2004-04-14 18:00:00
14/04/2004,19:00:00,-200.0,1234.0,150.0,,1095.0,180.0,789.0,109.0,1638.0,1212.0,-200.0,-200.0,-200.0,2004-04-14 19:00:00
